jprod_id,contractor_name,contract_number,manufacturer_part_number,manufacturer_name,vendor_part_number,nsn,upc,country_of_origin,product_name,product_description,sin,price,unspc,gsin,date_last_updated,source
18932,"10GFEDSUPPLY, LLC",47QSEA20D003B,0800000109019,Simple Green.,41325119,"",00043318004896,US,1 GPM Proportioner,1 GPM Proportioner,332510C,155.79,40141700,11000061967146,2023-10-31T00:00:00.000000,reference
21536,"10GFEDSUPPLY, LLC",47QSEA20D003B,101877,ACI,101877,"","",IT,Cam & Disconnect Switches; Enclosure Ty,Cam & Disconnect Switches; Enclosure Type: Open ; Number of Phases: 1 ; Amperage: 40 ; Number of Poles: 1,332510C,332.86,39121500,11000052034893,2023-10-11T00:00:00.000000,reference
25952,"10GFEDSUPPLY, LLC",47QSEA20D003B,031006VG,DDS,23021322,"","",TW,Automotive Shaft Seals; Seal Type: VG ;,Automotive Shaft Seals; Seal Type: VG ; Inside Diameter (Decimal Inch): 3 ; Color: Green; Black ; Hardness: 70 Shore A,332510C,18.15,25174204,11000095819016,2023-10-31T00:00:00.000000,reference
38922,"10GFEDSUPPLY, LLC",47QSEA20D003B,0.0983 CLASS X,MSC,0.0983 CLASS X,"","",US,Class X Plus Plug & Pin Gages; Diameter,Class X Plus Plug & Pin Gages; Diameter of Measurement (Decimal Inch): 0.0983in; Overall Length: 2.25in ; Tolerance: 0in; 0.00004in ; Material: Tool Steel ; Application: For Production Inspection Requirements,332510C,17.19,41111619,11000101089941,2023-10-11T00:00:00.000000,reference
39501,"10GFEDSUPPLY, LLC",47QSEA20D003B,0.4855 CLASS X,MSC,0.4855 CLASS X,"","",US,Class X Plus Plug & Pin Gages; Diameter,Class X Plus Plug & Pin Gages; Diameter of Measurement (Decimal Inch): 0.4855in; Overall Length: 3in ; Tolerance: 0in; 0.00004in ; Material: Tool Steel ; Application: For Production Inspection Requirements,332510C,16.35,41111619,11000101067076,2023-10-11T00:00:00.000000,reference
42293,"10GFEDSUPPLY, LLC",47QSEA20D003B,0009512500,Osborn International,9678145,"","",US,"2"" Roller Diam x 1-11/16"" Width, 7/8"" St","2 Roller Diam x 1-11/16 Width, 7/8 Stud Diam x 2 Length, Concentric Stud Load Runner",332510C,74.6,31171505,11000085366087,2023-10-31T00:00:00.000000,reference
42348,"10GFEDSUPPLY, LLC",47QSEA20D003B,05003531001,Wera,79117313,"","",CZ,"1/4"" Drive Socket Extension",1/4 Drive Socket Extension,332510C,11.48,27112809,11000049850303,2023-10-31T00:00:00.000000,reference
61344,"10GFEDSUPPLY, LLC",47QSEA20D003B,1.2874 PLUS,Vermont Gage,1.2874 PLUS,"","",US,Individual Class Zz Minus,1.2874 Diam Class ZZ Plus Plug & Pin Gage,332510C,57.94,41111619,11000010307754,2023-12-28T00:00:00.000000,reference
70392,"10GFEDSUPPLY, LLC",47QSEA20D003B,1.9297+TRILOCK,Vermont Gage,1.9297+TRILOCK,"","",US,Individual Class Zz Minus,1.9297 Diam Class ZZ Plus Plug & Pin Gage,332510C,86.9,41111619,11000010334355,2023-12-28T00:00:00.000000,reference
72511,"10GFEDSUPPLY, LLC",47QSEA20D003B,106-8-H,Vortec,6414155,"","",US,"6-1/4"" Long Hose, 400 BTU/Hr Air Capacit","6-1/4 Long Hose, 400 BTU/Hr Air Capacity, 1 Outlet, Cold Air Coolant System",332510C,245.44,40101700,11000016021781,2023-10-31T00:00:00.000000,reference
92439,"10GFEDSUPPLY, LLC",47QSEA20D003B,1828A.008,Emuge,47936570,"","",DE,8mm Diam 6-Flute 50&deg; Solid Carbide 0,"8mm Diam 6-Flute 50&deg; Solid Carbide 0.10mm Chamfer Length Square Roughing & Finishing End Mill TiAlN Finish, 24mm LOC, 68mm OAL, 8mm Shank Diam, Extra Long Length, Series 1828A",332510C,98.28,27112803,11000091634832,2023-10-31T00:00:00.000000,reference
99435,"10GFEDSUPPLY, LLC",47QSEA20D003B,32973,Wiha,33599200,"",00084705329734,DE,"22 Piece Insulated Pliers, Nut Driver, S","22 Piece Insulated Pliers, Nut Driver, Slim Screwdrivers, T-Handle Hand Tool Set",332510C,390.35,27113201,11000039087230,2023-10-31T00:00:00.000000,reference
111752,"10GFEDSUPPLY, LLC",47QSEA20D003B,18226,Melin Tool,18226,"",00733438182269,US,"3/4"" Head Diam, 1/2"" Shank Diam, 6 Flut","3/4 Head Diam, 1/2 Shank Diam, 6 Flute 90&deg; Cobalt Countersink TiN Finish, 2-3/4 OAL, Single End, Straight Shank, Right Hand Cut",332510C,46.12,23241611,11000057470494,2023-10-11T00:00:00.000000,reference
114922,"10GFEDSUPPLY, LLC",47QSEA20D003B,19110,Vaughan Bushnell,8279200,"",00051218191103,US,"3 Lb Head, 10-1/4"" Long Drilling Hammer","3 Lb Head, 10-1/4 Long Drilling Hammer",332510C,38.95,27111602,11000016035713,2023-10-31T00:00:00.000000,reference
119522,"10GFEDSUPPLY, LLC",47QSEA20D003B,18HWAPD,Sumitomo,18HWAPD,"","",JP,Grooving,"Grooving Insert: GCM4020RN AC520U, Solid Carbide",332510C,26.25,31162802,11000097052672,2023-12-28T00:00:00.000000,reference
119892,"10GFEDSUPPLY, LLC",47QSEA20D003B,18414,Dynabrade,9048430,"",00616026184145,TW,Air Die Grinder O-Ring,Air Die Grinder O-Ring,332510C,2.14,31181506,11000063993478,2023-10-31T00:00:00.000000,reference
127965,"10GFEDSUPPLY, LLC",47QSEA20D003B,30C-8,Hollaender,30C-8,"","",US,"1-1/2"" Pipe, Aluminum Alloy Swivel Sock","1-1/2 Pipe, Aluminum Alloy Swivel Socket Pipe Rail Fitting Bright Finish",332510C,36.58,21101510,11000010053980,2023-10-11T00:00:00.000000,reference
129150,"10GFEDSUPPLY, LLC",47QSEA20D003B,2.0097- TRILOCK,Vermont Gage,2.0097- TRILOCK,"","",US,Individual Class Zz Minus,Class ZZ Minus Plug & Pin Gage: 2.0097 Dia,332510C,79.66,41111619,11000010336063,2023-12-28T00:00:00.000000,reference
131492,"10GFEDSUPPLY, LLC",47QSEA20D003B,3001603,Ham-Let,3001603,"","",IL,"1/8"" Tube OD Stainless Steel Compressio",1/8 Tube OD Stainless Steel Compression Tube Union Comp x Comp Ends,332510C,13.9,27121700,11000016199296,2023-10-11T00:00:00.000000,reference
150427,"10GFEDSUPPLY, LLC",47QSEA20D003B,31899,SGS,31899,"","",US,"Single,Keyway Spiral Flute","1 Diam, 2-1/4 LOC, 2 Flute Solid Carbide Ball End Mill",332510C,718.69,23241611,11000013335384,2023-12-28T00:00:00.000000,reference
158914,"10GFEDSUPPLY, LLC",47QSEA20D003B,39124,Value Collection,70996087,"","",CA,"1/2-13 UNC, 8"" Length Under Head Hex Hea","1/2-13 UNC, 8 Length Under Head Hex Head Cap Screw",332510C,48.86,31161501,11000086425312,2023-10-31T00:00:00.000000,reference
160326,"10GFEDSUPPLY, LLC",47QSEA20D003B,315316,GWS,14553200,"","",US,Ball End Mills; Mill Diameter (Inch): 5/,Ball End Mills; Mill Diameter (Inch): 5/8 ; Mill Diameter (Decimal Inch): 0.6250; Number of Flutes: 3 ; Length of Cut (Inch): 3/4 ; Material: Solid Carbide ; Overall Length (Inch): 3-1/2,332510C,92.42,27112803,11000091609821,2023-10-31T00:00:00.000000,reference
173241,"10GFEDSUPPLY, LLC",47QSEA20D003B,420816,GWS,14570196,"","",US,Threaded Shank Drill Bits; Drill Point A,Threaded Shank Drill Bits; Drill Point Angle: 120 ; Point Type: Reamer ; Shank Type: Threaded,332510C,57.79,23241634,11000091713848,2023-10-31T00:00:00.000000,reference
185043,"10GFEDSUPPLY, LLC",47QSEA20D003B,4500569,Accupro,4500569,"","",KR,"Taper Length Drill Bit: 0.4688"" Dia, 14","Taper Length Drill Bit: 0.4688 Dia, 140 &deg; TiAlN Finish, RH Cut, Spiral Flute, Straight Shank",332510C,296.03,27112803,11000081024225,2023-10-11T00:00:00.000000,reference
188458,"10GFEDSUPPLY, LLC",47QSEA20D003B,4130030,Kennametal,4130030,"","",US,#4-40 UNC Plug Thread Forming Tap,"#4-40 UNC Plug Thread Forming Tap Vanadium High Speed Steel, TiN Finish, 1.88 OAL, 0.313 Thread Length, Right Hand Thread, H3 Thread Limit",332510C,38.78,27112806,11000022668297,2023-10-11T00:00:00.000000,reference
195155,"10GFEDSUPPLY, LLC",47QSEA20D003B,48225,MSC,48225,"","",US,"0.145 Inch Diameter, Seine Cable Cord T","0.145 Inch Diameter, Seine Cable Cord Twine 160 Lbs. Breaking Strength, White, 220 Ft. per Lb.",332510C,20.47,31151507,11000101123539,2023-10-11T00:00:00.000000,reference
204192,"10GFEDSUPPLY, LLC",47QSEA20D003B,48508,SGS,48508,"","",US,"Single,Keyway Spiral Flute","Square End Mill: 0.1969'' Dia, 0.6299'' LOC, 4 Flutes, Solid Carbide",332510C,29.15,23241611,11000013828267,2023-12-28T00:00:00.000000,reference
207254,"10GFEDSUPPLY, LLC",47QSEA20D003B,53029,Starrett,53029,"","",US,Punches,Punch Sets,332510C,17.31,27112502,11000072568988,2023-12-28T00:00:00.000000,reference
211701,"10GFEDSUPPLY, LLC",47QSEA20D003B,47131,SGS,47131,"","",US,Co Coarse Tooth Roughing Em,"16mm Diam, Variable Pitch, 35mm LOC, 5 Flute Solid Carbide Corner Radius Roughing End Mill",332510C,282.81,27112803,11000097047752,2023-12-28T00:00:00.000000,reference
212076,"10GFEDSUPPLY, LLC",47QSEA20D003B,4702451,IDEAL TRIDON,4702451,"","",MX,Stainless Steel Auto-Adjustable Worm Dr,"Stainless Steel Auto-Adjustable Worm Drive Clamp 1/2 Wide x 1/2 Thick, 1-1/16 Hose, 1-1/16 to 2 Diam",332510C,4.74,31162900,11000041486521,2023-10-11T00:00:00.000000,reference
216229,"10GFEDSUPPLY, LLC",47QSEA20D003B,497.58x4x75BYL,Wearwell,497.58x4x75BYL,"","",US,Mats & Runners - Anti-Fatigue,"Anti-Fatigue Mat: 900 Length, 48 Wide, 5/8 Thick, Vinyl, Beveled Edge, Medium-Duty",332510C,1496.64,52101510,11000030205683,2023-12-28T00:00:00.000000,reference
224237,"10GFEDSUPPLY, LLC",47QSEA20D003B,6424621,Walter,6424621,"","",DE,Blades,G2042 N Double End Neutral Indexable Cutoff Blade,332510C,204.14,23171804,11000066423142,2023-12-28T00:00:00.000000,reference
228529,"10GFEDSUPPLY, LLC",47QSEA20D003B,5724092,Sandvik Coromant,41064460,"","",SE,CCMT32.50-MF 1125 Carbide Turning Insert,CCMT32.50-MF 1125 Carbide Turning Insert,332510C,23.54,23171618,11000066417545,2023-10-31T00:00:00.000000,reference
229473,"10GFEDSUPPLY, LLC",47QSEA20D003B,5113722,Walter,5113722,"","",BG,Blades,0.157 Min Width x 0.827 Max Depth MSS-E Right Hand Indexable Grooving Blade,332510C,230.49,27112809,11000092794658,2023-12-28T00:00:00.000000,reference
232998,"10GFEDSUPPLY, LLC",47QSEA20D003B,520MI9W,Leviton,520MI9W,"","",SE,Pin & Sleeve Receptacles; Receptacle/Pa,Pin & Sleeve Receptacles; Receptacle/Part Type: Interlock ; Pin Configuration: 5; Number of Poles: 4 ; IEC Pin & Sleeve Style: IEC 60309-1; IEC 60309-2 ; Amperage: 20 ; Voltage: 120/208 VAC,332510C,1169.41,39121610,11000002450060,2023-10-11T00:00:00.000000,reference
237641,"10GFEDSUPPLY, LLC",47QSEA20D003B,7382631,Sandvik Coromant,7382631,"","",DE,Sp Fl Hand Tap,3 Flute 6HX Spiral Flute Tap,332510C,59.09,27112806,11000086376523,2023-12-28T00:00:00.000000,reference
239302,"10GFEDSUPPLY, LLC",47QSEA20D003B,8000401225,Guden,8000401225,"","",US,"4"" Long x 4"" Wide 302/304 Stainless Ste",4 Long x 4 Wide 302/304 Stainless Steel Commercial Hinge 8 Holes,332510C,29.77,27112113,11000080999760,2023-10-11T00:00:00.000000,reference
245358,"10GFEDSUPPLY, LLC",47QSEA20D003B,62950,ZEP,62950,"","",US,Voc Ca Only,20 Gal Drum Automotive Windshield Washer,332510C,562.44,47131801,11000070368650,2023-12-28T00:00:00.000000,reference
250236,"10GFEDSUPPLY, LLC",47QSEA20D003B,74130998,Hertel,74130998,"","",US,"Screw Machine Length Drill Bit: 0.0785""","Screw Machine Length Drill Bit: 0.0785 Dia, 135 &deg;, Cobalt Bright/Uncoated, Right Hand Cut, Spiral Flute, Straight-Cylindrical Shank",332510C,1.95,23241605,11000078048863,2023-10-11T00:00:00.000000,reference
252187,"10GFEDSUPPLY, LLC",47QSEA20D003B,6056832,Sandvik Coromant,6056832,"","",SE,Boring Bars,"25mm Min Bore, Left Hand A..PCLNR/L Indexable Boring Bar",332510C,419.54,27112809,11000085644996,2023-12-28T00:00:00.000000,reference
261704,"10GFEDSUPPLY, LLC",47QSEA20D003B,66253262704,Norton,5987722,"",00662532627041,MX,"Surface Grinding Wheel: 12"" Dia, 1"" Thic","Surface Grinding Wheel: 12 Dia, 1 Thick, 3 Hole, 46 Grit, J Hardness",332510C,128.35,23131503,11000077569563,2023-10-31T00:00:00.000000,reference
262404,"10GFEDSUPPLY, LLC",47QSEA20D003B,69957399629,Merit Abrasives,69957399629,"",00699573996294,US,"Quick-Change Disc: Power-Lock Type 2, 1","Quick-Change Disc: Power-Lock Type 2, 1-1/2 Disc Dia, 60 Grit, Aluminum Oxide, Coated Brown, Cloth Backed, 30,000 RPM",332510C,0.4,31191506,11000041513988,2023-10-11T00:00:00.000000,reference
262669,"10GFEDSUPPLY, LLC",47QSEA20D003B,74392,SGS,74392,"","",US,Corner Radius,8 Diam 7 Flute Solid Carbide 2mm Corner Radius End Mill,332510C,92.39,27112803,11000092745284,2023-12-28T00:00:00.000000,reference
270954,"10GFEDSUPPLY, LLC",47QSEA20D003B,78049,Dynabrade,87504940,"",00616026780491,US,"Abrasive Belt: 1/2"" Width, Aluminum Oxid","Abrasive Belt: 1/2 Width, Aluminum Oxide Non-Woven, Dry & Wet",332510C,6.82,31191507,11000061932377,2023-10-31T00:00:00.000000,reference
275979,"10GFEDSUPPLY, LLC",47QSEA20D003B,6745147,Walter-Titex,6745147,"","",FR,Hss Rt Hnd Screw Mach Drill118,"Screw Machine Length Drill Bit: 0.4094 Dia, 140 &deg;, Solid Carbide",332510C,252.07,23241634,11000092805549,2023-12-28T00:00:00.000000,reference
276301,"10GFEDSUPPLY, LLC",47QSEA20D003B,8850717,Kyocera,8850717,"","",CH,XPMT090208 PR1525 Carbide Milling Inser,"XPMT090208 PR1525 Carbide Milling Insert Megacoat Nano Finish, 0.325 Long x 0.094 Thick x 1/4 Wide",332510C,27.07,23171612,11000066422586,2023-10-11T00:00:00.000000,reference
287671,"10GFEDSUPPLY, LLC",47QSEA20D003B,9031460035700,Guhring,58536723,"","",DE,"Square End Mill: 9/64'' Dia, 1/2'' LOC,","Square End Mill: 9/64'' Dia, 1/2'' LOC, 3/16'' Shank Dia, 2'' OAL, 2 Flutes, Solid Carbide Single End, Uncoated, Spiral Flute, Centercutting, RH Cut, RH Flute,Series 3146",332510C,22.92,27112803,11000097053488,2023-10-31T00:00:00.000000,reference
287804,"10GFEDSUPPLY, LLC",47QSEA20D003B,818,Dixon Valve & Coupling,818,"","",US,"7-11/16 to 8-3/16"" OD, Double Bolt Iron","7-11/16 to 8-3/16 OD, Double Bolt Iron Clamp Plated Malleable Iron",332510C,68.75,31162906,11000013325482,2023-10-11T00:00:00.000000,reference
295332,"10GFEDSUPPLY, LLC",47QSEA20D003B,C24188,Cleveland,C24188,"",00697334241881,US,"120&deg; 4"" OAL High Speed Steel Spotti","120&deg; 4 OAL High Speed Steel Spotting Drill Bright/Uncoated, 1 Flute Length,1/4 Shank Diam, RH Cut, Series 2645",332510C,25.25,52101508,11000043913094,2023-10-11T00:00:00.000000,reference
296059,"10GFEDSUPPLY, LLC",47QSEA20D003B,9003290106000,Guhring,69338838,"","",DE,"Screw Machine Length Drill Bit: 0.4173""","Screw Machine Length Drill Bit: 0.4173 Dia, 130 &deg;, Cobalt Coated, Right HandCut, Spiral Flute, Straight-Cylindrical Shank, Series 329",332510C,56.57,23241606,11000028488374,2023-10-31T00:00:00.000000,reference
296712,"10GFEDSUPPLY, LLC",47QSEA20D003B,83863,Keo,83863,"","",US,"5"" Diam x 11/32"" Face Width Staggered T","5 Diam x 11/32 Face Width Staggered Tooth Side Milling Cutter 1 Arbor Hole, HighSpeed Steel, TiCN Finish, 24 Teeth",332510C,332.09,23151901,11000057201613,2023-10-11T00:00:00.000000,reference
298443,"10GFEDSUPPLY, LLC",47QSEA20D003B,9006050046200,Guhring,55082978,"","",DE,"Jobber Length Drill Bit: 0.182"" Dia, 130","Jobber Length Drill Bit: 0.182 Dia, 130 &deg;, Cobalt Bright/Uncoated, RH Cut, Spiral Flute, Straight-Cylindrical Shank",332510C,5.8,23241634,11000097030443,2023-10-31T00:00:00.000000,reference
298625,"10GFEDSUPPLY, LLC",47QSEA20D003B,9003450159000,Guhring,69343960,"","",DE,"Taper Shank Drill Bit: 0.626"" Dia, 2MT,","Taper Shank Drill Bit: 0.626 Dia, 2MT, 118 &deg;, Cobalt Oxide Finish, 4.7244 Flute Length, 8.5827 OAL, Cone Relief Point, Spiral Flute",332510C,134.41,23241634,11000097049424,2023-10-31T00:00:00.000000,reference
310717,"10GFEDSUPPLY, LLC",47QSEA20D003B,71146,Collis Tool,71146,"",00662669711460,US,"#32, MT1 Outside Morse Taper, Drill Dri","#32, MT1 Outside Morse Taper, Drill Driver 3/16 Inch Projection",332510C,36.63,23241606,11000018355938,2023-10-11T00:00:00.000000,reference
313029,"10GFEDSUPPLY, LLC",47QSEA20D003B,9006510112000,Guhring,58590985,"","",DE,"Jobber Length Drill Bit: 0.4409"" Dia, 11","Jobber Length Drill Bit: 0.4409 Dia, 118 &deg;, High Speed Steel TiN Finish, RHCut, Spiral Flute, Straight-Cylindrical Shank, Series 651",332510C,40.25,23241634,11000097011387,2023-10-31T00:00:00.000000,reference
315996,"10GFEDSUPPLY, LLC",47QSEA20D003B,9003450138900,Guhring,69337905,"","",DE,"Taper Shank Drill Bit: 0.5469"" Dia, 1MT,","Taper Shank Drill Bit: 0.5469 Dia, 1MT, 118 &deg;, Cobalt Oxide Finish, 4.252 Flute Length, 7.4409 OAL, Cone Relief Point, Spiral Flute",332510C,101.06,23241634,11000096964926,2023-10-31T00:00:00.000000,reference
320388,"10GFEDSUPPLY, LLC",47QSEA20D003B,9012430075400,Guhring,9012430075400,"","",DE,"Jobber Length Drill Bit: 0.2969"" Dia, 1","Jobber Length Drill Bit: 0.2969 Dia, 140 &deg;, Solid Carbide TiN Finish, RH Cut, Spiral Flute, Straight-Cylindrical Shank",332510C,121.56,23241605,11000016210219,2023-10-11T00:00:00.000000,reference
323171,"10GFEDSUPPLY, LLC",47QSEA20D003B,7000051872,3M,7000051872,"","",US,Full Face Mask Replacement Lens,Full Face Mask Replacement Lens Facepiece Replacement Parts and Adapter,332510C,125.87,46182001,11000084533703,2023-10-11T00:00:00.000000,reference
327414,"10GFEDSUPPLY, LLC",47QSEA20D003B,7549912,Sandvik Coromant,7549912,"","",SE,Drilling,DS20-0205-P-H5W 2044 Carbide Indexable Drill Insert,332510C,26.17,23241605,11000086359898,2023-12-28T00:00:00.000000,reference
337997,"10GFEDSUPPLY, LLC",47QSEA20D003B,70794,Albrecht,70794,"","",DE,Drill Chuck Jaw Guide,"Drill Chuck Jaw Guide Compatible with Chuck No. C160; CP160, For Use with Classic Keyless, Classic-Plus Drill Chucks",332510C,106.93,27112807,11000074665132,2023-10-11T00:00:00.000000,reference
338172,"10GFEDSUPPLY, LLC",47QSEA20D003B,89604,PFERD,49177470,"",00697940896048,US,"3/4"" Wide Horsehair Acid Brush",3/4 Wide Horsehair Acid Brush,332510C,1.2,27113002,11000013291230,2023-10-31T00:00:00.000000,reference
340565,"10GFEDSUPPLY, LLC",47QSEA20D003B,K7160-16-100,Kuriyama of America,K7160-16-100,"","",CA,"1"" ID x 1.29"" OD, 100' Long, PVC Tube","1 ID x 1.29 OD, 100' Long, PVC Tube Clear, 70 Max psi",332510C,631.13,40142000,11000022669984,2023-10-11T00:00:00.000000,reference
340787,"10GFEDSUPPLY, LLC",47QSEA20D003B,ISCC-087-062,Climax Metal Products,ISCC-087-062,"",00044861414026,US,"7/8"" Inside x 1-5/8"" Outside Diam, One","7/8 Inside x 1-5/8 Outside Diam, One Piece Split Clamping Collar 2-1/2 Long",332510C,60.55,31162811,11000036695802,2023-10-11T00:00:00.000000,reference
341996,"10GFEDSUPPLY, LLC",47QSEA20D003B,9046310100060,Guhring,12265104,"","",DE,Pionex M10x1.25 Metric Fine 3-Flute Clas,"Pionex M10x1.25 Metric Fine 3-Flute Class 6HX Bottoming Spiral Flute Tap HSS-E,TiAlN Finish, 100mm OAL, D5/D6 Limit, RH Flute, RH Thread, Through Coolant, Series 4631",332510C,76.07,60131203,11000091605560,2023-10-31T00:00:00.000000,reference
343273,"10GFEDSUPPLY, LLC",47QSEA20D003B,793U 1-1/2,Hertel,793U 1-1/2,"",00728012216508,US,1-1/2 - 11-1/2 7-Flute Bright Finish Ca,"1-1/2 - 11-1/2 7-Flute Bright Finish Carbon Steel Standard Flute Tap 4-1/4 OAL,NPT",332510C,94.76,27112806,11000078044809,2023-10-11T00:00:00.000000,reference
350148,"10GFEDSUPPLY, LLC",47QSEA20D003B,88 01 180,Knipex,88 01 180,"",00843221000172,DE,"7-1/4"" OAL, 1-1/2"" Max Capacity, 9 Posi","7-1/4 OAL, 1-1/2 Max Capacity, 9 Position Water Pump Tongue & Groove Pliers Self-Gripping V-Jaws, Alligator Jaw Head, Plastic Dipped Handles",332510C,31.9,27111577,11000011779508,2023-10-11T00:00:00.000000,reference
355976,"10GFEDSUPPLY, LLC",47QSEA20D003B,9257470060090,Guhring,94891678,"","",DE,"Profile Boring Bar: 5.7 mm Min Bore, 37","Profile Boring Bar: 5.7 mm Min Bore, 37 mm Max Depth, Left Hand Cut, Fine GrainSolid Carbide 6  mm Shank Dia, 62  mm OAL, 0.3  mm Corner Radius",332510C,48.82,41113901,11000091668336,2023-10-31T00:00:00.000000,reference
359347,"10GFEDSUPPLY, LLC",47QSEA20D003B,9690234,Wika,75209395,"","",US,"1-1/2"" Dial, 1/8 Thread, 0-100 Scale Ran","1-1/2 Dial, 1/8 Thread, 0-100 Scale Range, Pressure Gauge",332510C,21.36,41112403,11000016154091,2023-10-31T00:00:00.000000,reference
359974,"10GFEDSUPPLY, LLC",47QSEA20D003B,DHX11141,Tekton,DHX11141,"","",US,Hex Screwdrivers,9/64 Inch Hex High-Torque Screwdriver,332510C,12.31,27111701,11000084723658,2023-12-28T00:00:00.000000,reference
360580,"10GFEDSUPPLY, LLC",47QSEA20D003B,9056120033000,Guhring,58524828,"","",DE,"Taper Length Drill Bit: 0.1299"" Dia, 140","Taper Length Drill Bit: 0.1299 Dia, 140 &deg; FIREX Finish, RH Cut, Spiral Flute, Straight Shank, Series 5612",332510C,224.83,23241634,11000097133079,2023-10-31T00:00:00.000000,reference
366054,"10GFEDSUPPLY, LLC",47QSEA20D003B,AC742111AG-01A,PRO-SOURCE,12757928,"","",TW,11 Drawer Top Tool Chest,11 Drawer Top Tool Chest,332510C,867.52,24112401,11000098267844,2023-10-31T00:00:00.000000,reference
374441,"10GFEDSUPPLY, LLC",47QSEA20D003B,9069850079420,Guhring,18055152,"","",DE,"5/16"" Diam 5 Flute Solid Carbide 0.02"" C","5/16 Diam 5 Flute Solid Carbide 0.02 Corner Radius End Mill Nano-A Finish, 2 OAL, 7/16 LOC, 5/16 Shank Diam, 38&deg; Helix, RH Cut, RH Flute",332510C,68.69,27112803,11000091669961,2023-10-31T00:00:00.000000,reference
375056,"10GFEDSUPPLY, LLC",47QSEA20D003B,LH199,Value Collection,LH199,"","",GB,Label Holders For Shelving,Label Holders; Backing: Magnetic ; Width (Inch): 8 ; Length (Inch): 3 ; Color: Black,332510C,194.71,55121618,11000098297065,2023-12-28T00:00:00.000000,reference
376076,"10GFEDSUPPLY, LLC",47QSEA20D003B,91196584,Hertel,91196584,"","",ES,"Square End Mill: 3/8'' Dia, 3/8'' LOC,","Square End Mill: 3/8'' Dia, 3/8'' LOC, 3/8'' Shank Dia, 2-5/32'' OAL, 4 Flutes,Cobalt Single End, TiCN Finish, 30 &deg; Helix, Centercutting, RH Cut, RH Flute",332510C,15.5,27112803,11000084031687,2023-10-11T00:00:00.000000,reference
380970,"10GFEDSUPPLY, LLC",47QSEA20D003B,9256350120030,Guhring,90274218,"","",DE,GA305.0300.150.AA.04.L Carbide Grooving,"GA305.0300.150.AA.04.L Carbide Grooving Insert Firex Finish, LH, 3mm Cutting Width, 3mm Max Depth",332510C,44.94,23241605,11000097021394,2023-10-31T00:00:00.000000,reference
392839,"10GFEDSUPPLY, LLC",47QSEA20D003B,ALX40 LAT 613,Schlage,ALX40 LAT 613,"","",MX,Grade 1 Locksets,Lever Locksets; Type: Cylindrical Lock ; Key Type: Keyless ; Strike Type: CurvedLip Strike ; Finish/Coating: Oil Rubbed Bronze ; Material: Metal ; Material: Metal,332510C,282.24,46171503,11000098357490,2023-12-28T00:00:00.000000,reference
393818,"10GFEDSUPPLY, LLC",47QSEA20D003B,EG31CC6L2.5X1.5,VNE,4552345,"","",IL,"2-1/2 x 1-1/2"" Clamp Style Sanitary Stai",2-1/2 x 1-1/2 Clamp Style Sanitary Stainless Steel Pipe Concentric Reducer,332510C,112.52,27131502,11000023308637,2023-10-31T00:00:00.000000,reference
396615,"10GFEDSUPPLY, LLC",47QSEA20D003B,SGA8072,Telemecanique Sensors,SGA8072,"","",US,Sensor,"0.8 Inch Detection, Cylinder, Inductive Proximity Sensor",332510C,130.2,41111926,11000043990174,2023-12-28T00:00:00.000000,reference
407914,"10GFEDSUPPLY, LLC",47QSEA20D003B,BRTPC202RF,BROTHER INTL. CORP.,BRTPC202RF,"",00012502054184,JP,"Pc-202rf Thermal Transfer Refill Roll,","Pc-202rf Thermal Transfer Refill Roll, 450 Page-Yield, Black, 2/pack",339940,50.29,44103112,11000000941241,2023-07-28T00:00:00.000000,reference
413818,"10GFEDSUPPLY, LLC",47QSEA20D003B,NSN2074231,ABILITYONE,NSN2074231,"",00827180742311,US,7520012074231 Skilcraft Pre-Inked Messa,"7520012074231 Skilcraft Pre-Inked Message Stamp, Received, Red",339940,9.11,44121604,11000003953482,2023-07-28T00:00:00.000000,reference
421005,"10GFEDSUPPLY, LLC",47QSEA20D003B,LHGT124-12,Scientific Cutting Tools,LHGT124-12,"","",US,Solid Carbide Grooving,Grooving Tool: Retaining Ring,332510C,98.75,27112809,11000092811392,2023-12-28T00:00:00.000000,reference
441804,"10GFEDSUPPLY, LLC",47QSEA20D003B,E7WWW-6L1.0,VNE,4652608,"","",IL,"1"" Weld Style Sanitary Stainless Steel P",1 Weld Style Sanitary Stainless Steel Pipe Tee,332510C,42.53,40142605,11000028589362,2023-10-31T00:00:00.000000,reference
444448,"10GFEDSUPPLY, LLC",47QSEA20D003B,C6NC-1/4-100,MSC,C6NC-1/4-100,"","",US,"1/4"" Head Diam, 1/4"" Shank Diam, 6 Flut","1/4 Head Diam, 1/4 Shank Diam, 6 Flute 100&deg; Solid Carbide Countersink BrightFinish, 2 OAL, 0.046 Nose Diam, Single End, Straight Shank, Right Hand Cut",332510C,34.19,27112803,11000100649374,2023-10-11T00:00:00.000000,reference
447234,"10GFEDSUPPLY, LLC",47QSEA20D003B,EG40E6.0,VNE,EG40E6.0,"","",US,Ss Sanitary & Clamp Type Fitng,6 Clamp Style Sanitary EPDM Pipe Gasket,332510C,34.06,31162906,11000097102782,2023-12-28T00:00:00.000000,reference
459946,"10GFEDSUPPLY, LLC",47QSEA20D003B,CFR23375H,Hertel,CFR23375H,"",00733438161011,US,"3/32"" Radius, 3/8"" Diam, 4 Flute Solid","3/32 Radius, 3/8 Diam, 4 Flute Solid Carbide Corner Rounding End Mill Single End, Uncoated, 2-1/2 OAL, 3/8 Shank Diam",332510C,49.18,27112803,11000078046713,2023-10-11T00:00:00.000000,reference
461351,"10GFEDSUPPLY, LLC",47QSEA20D003B,GR25-3/16,Value Collection,4020103,"","",GB,3/16 Inch Diameter Carbide Ball,3/16 Inch Diameter Carbide Ball,332510C,6.62,27112803,11000074107970,2023-10-31T00:00:00.000000,reference
462814,"10GFEDSUPPLY, LLC",47QSEA20D003B,CHP5161,CHASE PRODUCTS CO.,ESSCHP5161,"",00010228351617,US,"CLEANER,A-PUR,FM,18OZ,12","Heavy-Duty All-Purpose Cleaner/degreaser, 18oz, Aerosol, 12/carton UPC=00010228351617 UPC=00010228351617",322291,40.04,47131805,11000053005598,2023-07-28T00:00:00.000000,reference
465572,"10GFEDSUPPLY, LLC",47QSEA20D003B,PS-MH-HPC1-016,Value Collection,59754903,"",00470775502748,TW,"1 Stage 1.594"" Piston Diam, 0.79"" Stroke","1 Stage 1.594 Piston Diam, 0.79 Stroke Steel Manual Hydraulic Pump",332510C,400.57,27121602,11000082228334,2023-10-31T00:00:00.000000,reference
466850,"10GFEDSUPPLY, LLC",47QSEA20D003B,TC53487,Titan USA,TC53487,"","",US,Single End Regular Length,"Square End Mill: 3/32'' Dia, 1-1/8'' LOC, 1/8'' Shank Dia, 2-1/2'' OAL, 3 Flutes, Solid Carbide",332510C,48.82,31162801,11000070487318,2023-12-28T00:00:00.000000,reference
471734,"10GFEDSUPPLY, LLC",47QSEA20D003B,TC53749,Titan USA,TC53749,"","",US,Single End Regular Length,Ball End Mills; Mill Diameter (mm): 0.90 ; Mill Diameter (Decimal Inch): 0.0350; Number of Flutes: 3 ; Length of Cut (Inch): 9/32 ; Length of Cut (Decimal Inch): 0.2810 ; Material: Solid Carbide,332510C,54.16,31162801,11000070479963,2023-12-28T00:00:00.000000,reference
474614,"10GFEDSUPPLY, LLC",47QSEA20D003B,ECR2025,Energizer.,ECR2025,"",00039800088581,IS,"Size CR2025, Lithium, Button & Coin Cel","Size CR2025, Lithium, Button & Coin Cell Battery 3 Volts, CR2025, ANSI, IEC, NEDA, UL Listed Regulated",332510C,1.61,26111711,11000044993224,2023-10-11T00:00:00.000000,reference
