jprod_id,contractor_name,contract_number,manufacturer_part_number,manufacturer_name,vendor_part_number,nsn,upc,country_of_origin,product_name,product_description,sin,price,unspc,gsin,date_last_updated,source
40585267,Mensch Supply,47QTCA20D002A,32973,Wiha,33599200,"",084705329734,DE,"Combination Hand Tool Set: 22 Pc, Insula","Combination Hand Tool Set: 22 Pc, Insulated Tool Set Comes in Canvas Pouch",332510C,296.84,27113201,11000039087230,2023-10-07T00:00:00.000000,competitor
40588380,Mensch Supply,47QTCA20D002A,18226,MELIN TOOL,18226,"",733438182269,US,"3/4"""" Head Diam, 1/2"""" Shank Diam, 6 Flu","3/4"""" Head Diam, 1/2"""" Shank Diam, 6 Flute 90 Cobalt Countersink TiN Finish, 2-3/4"""" OAL, Single End, Straight Shank, Right Hand Cut (MOQ=1, Pkg Qty=1)",332510C,44.01,23241611,11000057470494,2023-10-07T00:00:00.000000,competitor
40591473,Mensch Supply,47QTCA20D002A,31899,Harvey Tool,61636171,"","",US,"Square End Mill: 0.1'' Dia, 1/2'' LOC, 1","Square End Mill: 0.1'' Dia, 1/2'' LOC, 1/8'' Shank Dia, 2-1/2'' OAL, 3 Flutes, Solid Carbide Single End, Uncoated, 30 &deg; Helix, Centercutting, RH Cut, RH Flute",332510C,25.65,27112803,11000086441564,2023-10-07T00:00:00.000000,competitor
40593700,Mensch Supply,47QTCA20D002A,1828A.008,Emuge,47936570,"","",DE,8mm Diam 6-Flute 50&deg; Solid Carbide 0,"8mm Diam 6-Flute 50&deg; Solid Carbide 0.10mm Chamfer Length Square Roughing & Finishing End Mill TiAlN Finish, 24mm LOC, 68mm OAL, 8mm Shank Diam, Extra Long Length, Series 1828A",332510C,76.07,27112803,11000091634832,2023-10-07T00:00:00.000000,competitor
40613894,Mensch Supply,47QTCA20D002A,4130030,KENNAMETAL,4130030,"","",US,#4-40 UNC Plug Thread Forming Tap,"#4-40 UNC Plug Thread Forming Tap Vanadium High Speed Steel, TiN Finish, 1.88""""OAL, 0.313"""" Thread Length, Right Hand Thread, H3 Thread Limit (MOQ=1, Pkg Qty=1)",332510C,25.26,27112806,11000022668297,2023-10-07T00:00:00.000000,competitor
40647324,Mensch Supply,47QTCA20D002A,4500569,ISCAR,4500569,"","",IL,"3/8"""" Hole Diam, ER32 Taper Shank Shrink","3/8"""" Hole Diam, ER32 Taper Shank Shrink Fit Tool Holder & Adapter 2-1/2"""" Projection, 0.9"""" Nose Diam, 1.42"""" Clamping Depth, Through Coolant (MOQ=1, Pkg Qty=1)",332510C,111.3,31181600,11000063042474,2023-10-07T00:00:00.000000,competitor
40655382,Mensch Supply,47QTCA20D002A,39124,Jergens,82427600,"","",US,"Equal Double Threaded Stud: 1-8 Thread,","Equal Double Threaded Stud: 1-8 Thread, 6"" OAL Alloy Steel, Black Oxide Finish,Class 2A",332510C,18.06,31161600,11000016185980,2023-10-07T00:00:00.000000,competitor
40665988,Mensch Supply,47QTCA20D002A,3001603,HAM-LET,3001603,"","",IL,"1/8"""" Tube OD Stainless Steel Compressio","1/8"""" Tube OD Stainless Steel Compression Tube Union Comp x Comp Ends (MOQ=1, Pkg Qty=1)",332510C,12.86,27121700,11000016199296,2023-10-07T00:00:00.000000,competitor
40670191,Mensch Supply,47QTCA20D002A,420816,GWS,14570196,"","",US,Threaded Shank Drill Bits; Type: Aircraf,Threaded Shank Drill Bits; Type: Aircraft Drill ; Drill Bit Size (Decimal Inch):0.1875 ; Drill Bit Size (Inch): 0.1875 ; Drill Point Angle: 120 ; Shank Type: Threaded Shank ; Point Type: Reamer,332510C,48.61,23241634,11000091713848,2023-10-07T00:00:00.000000,competitor
40685254,Mensch Supply,47QTCA20D002A,315316,GWS,14553200,"","",US,"Ball End Mill: 0.625"" Dia, 3 Flute, Soli","Ball End Mill: 0.625"" Dia, 3 Flute, Solid Carbide 3-1/2"" OAL, 5/8"" Shank Dia, 37&deg; Helix, Uncoated, Single End, Series 2045",332510C,72.28,27112803,11000091609821,2023-10-07T00:00:00.000000,competitor
40688822,Mensch Supply,47QTCA20D002A,497.58x4x75BYL,Wearwell,30248835,"",154110153061,US,"Anti-Fatigue Mat: 900"" Length, 48"" Wide,","Anti-Fatigue Mat: 900"" Length, 48"" Wide, 5/8"" Thick, Vinyl, Beveled Edge, Medium-Duty Diamond Plate, Black & Yellow, Dry",332510C,1370.56,52101510,11000030205683,2023-10-07T00:00:00.000000,competitor
40707959,Mensch Supply,47QTCA20D002A,4702451,IDEAL TRIDON,05358866,"","",MX,"Worm Gear Clamp: SAE 24, 1-1/16 to 2"" Di","Worm Gear Clamp: SAE 24, 1-1/16 to 2"" Dia, Stainless Steel Band 1/2"" Wide, Stainless Steel Housing, Stainless Steel Screw, Series 47",332510C,3.5,31162900,11000041486521,2023-11-13T00:00:00.000000,competitor
40716627,Mensch Supply,47QTCA20D002A,47131,MSC,02099174,"","",US,Single Point Tool Bit: 3/8'' Shank Width,"Single Point Tool Bit: 3/8'' Shank Width, 3/8'' Shank Height, K21 Solid CarbideTipped, LH, BL, Lead Angle Turning 2-1/2'' OAL, 1/64'' Nose Radius",332510C,5.16,27112809,11000100643319,2023-10-07T00:00:00.000000,competitor
40717979,Mensch Supply,47QTCA20D002A,48225,MSC,67669127,"","",US,"Cable-Cord Twine: 0.145"" Twine Dia, Sein","Cable-Cord Twine: 0.145"" Twine Dia, Seine, White 160 lb Breaking Strength, 220 ft/lb",332510C,13.03,31151507,11000101123539,2023-11-13T00:00:00.000000,competitor
40731392,Mensch Supply,47QTCA20D002A,53029,KEO,53029,"",735329530296,US,"5 Piece, 1/4 to 1"""" Head Diam, 90&deg; I","5 Piece, 1/4 to 1"""" Head Diam, 90 Included Angle, Single End Countersink Set 1 Flute, High Speed Steel (MOQ=1, Pkg Qty=1)",332510C,99.75,23241606,11000010270775,2023-10-07T00:00:00.000000,competitor
40738371,Mensch Supply,47QTCA20D002A,5724092,SANDVIK COROMANT,5724092,"","",SE,CCMT32.50 MF Grade 1125 Carbide Turning,"CCMT32.50 MF Grade 1125 Carbide Turning Insert TiAlN/AlCr2O3 Finish, 80 Diamond,3/8"""" Inscr Circle, 5/32"""" Thick, 0.2mm Corner Radius (MOQ=1, Pkg Qty=1)",332510C,19.0,23171618,11000066417545,2023-10-07T00:00:00.000000,competitor
40746646,Mensch Supply,47QTCA20D002A,48508,CHICAGO-LATROBE,48508,"","",US,"1/8"""" 118&deg; Spiral Flute High Speed S","1/8"""" 118 Spiral Flute High Speed Steel Screw Machine Drill Bit Bright Finish, Right Hand Cut, 7/8"""" Flute Length, 1-7/8"""" OAL, Standard Point, Straight Shank (MOQ=12, Pkg Qty=1)",332510C,1.01,23241606,11000054074798,2023-10-07T00:00:00.000000,competitor
40787840,Mensch Supply,47QTCA20D002A,6745147,Walter-Titex,41794207,"","",FR,"Screw Machine Length Drill Bit: 0.4094""","Screw Machine Length Drill Bit: 0.4094"" Dia, 140 &deg;, Solid Carbide Coated, Right Hand Cut, Spiral Flute, Straight-Cylindrical Shank, Series DC170",332510C,278.82,23241634,11000092805549,2023-10-07T00:00:00.000000,competitor
40789861,Mensch Supply,47QTCA20D002A,69957399629,CARBORUNDUM,481-69957399629,"","",US,"SPE ZMD 1-1/2"" ARY19 MERP60 LTR SL2 NA+","SPE ZMD 1-1/2"" ARY19 MERP60 LTR SL2 NA+",332510C,4004.0,32111601,11000036704846,2023-10-07T00:00:00.000000,competitor
40808050,Mensch Supply,47QTCA20D002A,5113722,Walter,03446259,"","",BG,"Indexable Grooving Blade: Right Hand, 0.","Indexable Grooving Blade: Right Hand, 0.157"" Min Width 0.827"" Max Depth of Cut,Uses GX24-3.. Inserts",332510C,220.61,27112809,11000092794658,2023-10-07T00:00:00.000000,competitor
40810920,Mensch Supply,47QTCA20D002A,62950,PFERD,419-62950,"","",DE,4-1/2 X 5/8-11 POLIFAN SGP-STRONG ZIRKON,4-1/2 X 5/8-11 POLIFAN SGP-STRONG ZIRKON 36,332510C,166.58,31191506,11000028474302,2023-10-07T00:00:00.000000,competitor
40812143,Mensch Supply,47QTCA20D002A,66253262704,NORTON,66253262704,"",662532627041,MX,"12"""" Diam x 3"""" Hole x 1"""" Thick, J Hard","12"""" Diam x 3"""" Hole x 1"""" Thick, J Hardness, 46 Grit Surface Grinding Wheel Aluminum Oxide, Type 1, Coarse Grade, 2,070 Max RPM, Vitrified Bond, No Recess (MOQ=1, Pkg Qty=1)",332510C,118.46,23131503,11000077569563,2023-10-07T00:00:00.000000,competitor
40818215,Mensch Supply,47QTCA20D002A,70794,Starrett,86429800,"","",US,"Drop Indicator Contact Point: #4-48, 5.3","Drop Indicator Contact Point: #4-48, 5.33 mm Dia, 12.7 mm Contact Point Length Use with AGD Dial Indicators",332510C,10.64,41116501,11000072568480,2023-10-07T00:00:00.000000,competitor
40826499,Mensch Supply,47QTCA20D002A,6056832,Sandvik Coromant,49441348,"","",SE,"25mm Min Bore, Left Hand A..PCLNR/L Inde","25mm Min Bore, Left Hand A..PCLNR/L Indexable Boring Bar 250mm OAL, 20mm Shank Diam, -5&deg; Lead Angle, A..PCLNR/L Inserts, Through Coolant",332510C,344.42,27112809,11000085644996,2023-10-07T00:00:00.000000,competitor
40830601,Mensch Supply,47QTCA20D002A,7382631,Sandvik Coromant,46632634,"","",DE,"Spiral Flute Tap: 3 Flute, 6HX Class of","Spiral Flute Tap: 3 Flute, 6HX Class of Fit, Powdered Metal & High Speed Steel,Bright/Uncoated 0.315"" Thread Length",332510C,63.47,27112806,11000086376523,2023-11-13T00:00:00.000000,competitor
40830871,Mensch Supply,47QTCA20D002A,71146,COLLIS TOOL,71146,"","",US,"#32, MT1 Outside Morse Taper, Drill Driv","#32, MT1 Outside Morse Taper, Drill Driver 3/16 Inch Projection (MOQ=1, Pkg Qty=1)",332510C,31.66,23241606,11000018355938,2023-10-07T00:00:00.000000,competitor
40833889,Mensch Supply,47QTCA20D002A,520MI9W,Leviton,74366758,"","",SE,Pin & Sleeve Receptacles,Pin & Sleeve Receptacles,332510C,952.04,39121610,11000002450060,2023-10-07T00:00:00.000000,competitor
40847883,Mensch Supply,47QTCA20D002A,8000401225,Guden,00070334,"","",US,"Concealed Hinge: 4"" OAW, 4"" Door Leaf He","Concealed Hinge: 4"" OAW, 4"" Door Leaf Height, 2"" Door Leaf Width, 0.12"" Thick 8Mounting Holes, 4"" Frame Leaf Height, Stainless Steel Hinge",332510C,28.56,27112113,11000080999760,2023-11-13T00:00:00.000000,competitor
40860919,Mensch Supply,47QTCA20D002A,74130998,HERTEL,74130998,"","",US,#47 135&deg; Spiral Flute Cobalt Screw M,"#47 135 Spiral Flute Cobalt Screw Machine Drill Bit Bright Finish, Right Hand Cut, 3/4"""" Flute Length, 1-3/4"""" OAL, Split Point, Straight Shank (MOQ=12, Pkg Qty=1)",332510C,1.69,23241605,11000078048863,2023-10-07T00:00:00.000000,competitor
40861010,Mensch Supply,47QTCA20D002A,83863,Keo,44136414,"","",US,"Side Milling Cutter: 5"" Cutter Dia, 11/3","Side Milling Cutter: 5"" Cutter Dia, 11/32"" Cutting Width, 1"" Arbor Hole, 24 Teeth TiCN Finish, Staggered Tooth",332510C,312.05,23151901,11000057201613,2023-09-11T00:00:00.000000,competitor
40871951,Mensch Supply,47QTCA20D002A,9006510112000,Guhring,58590985,"","",DE,"Jobber Length Drill Bit: 0.4409"" Dia, 11","Jobber Length Drill Bit: 0.4409"" Dia, 118 &deg;, High Speed Steel TiN Finish, RHCut, Spiral Flute, Straight-Cylindrical Shank, Series 651",332510C,37.27,23241634,11000097011387,2023-10-07T00:00:00.000000,competitor
40882335,Mensch Supply,47QTCA20D002A,9012430075400,GUHRING,9012430075400,"","",DE,"19/64"""" 140&deg; Solid Carbide Jobber Dr","19/64"""" 140 Solid Carbide Jobber Drill TiN Finish, Right Hand Cut, Spiral Flute,Straight Shank, 90mm OAL, SU Point (MOQ=1, Pkg Qty=1)",332510C,113.6,23241605,11000016210219,2023-10-07T00:00:00.000000,competitor
40891020,Mensch Supply,47QTCA20D002A,7549912,Sandvik Coromant,13267075,"","",SE,"Indexable Drill Insert: DS20H5W 2044, Ca","Indexable Drill Insert: DS20H5W 2044, Carbide TiCN & Al2O3 Finish, Irregular",332510C,24.42,23241605,11000086359898,2023-10-07T00:00:00.000000,competitor
40903728,Mensch Supply,47QTCA20D002A,9046310100060,Guhring,12265104,"","",DE,"Spiral Flute Tap: M10 x 1.25, Metric Fin","Spiral Flute Tap: M10 x 1.25, Metric Fine, 3 Flute, Bottoming, 6HX Class of Fit,HSS-E, TiAlN Finish Right Hand Flute, Right Hand Thread, D5 & D6, Series 4631",332510C,64.17,60131203,11000091605560,2023-10-07T00:00:00.000000,competitor
40912439,Mensch Supply,47QTCA20D002A,74392,SGS,15166721,"",691781743929,US,"Corner Radius End Mill: 8"" Dia, 1.2598""","Corner Radius End Mill: 8"" Dia, 1.2598"" LOC, 7 Flutes, Solid Carbide 37 &deg; Helix, TiN Coated, Corner Radius End, Series 77",332510C,77.13,27112803,11000092745284,2023-10-07T00:00:00.000000,competitor
40917975,Mensch Supply,47QTCA20D002A,9690234,WIKA,9690234,"","",US,"1-1/2"""" Dial, 1/8 Thread, 0-100 Scale Ra","1-1/2"""" Dial, 1/8 Thread, 0-100 Scale Range, Pressure Gauge Center Back Connection Mount, Accurate to 3-2-3% of Scale (MOQ=1, Pkg Qty=1)",332510C,16.99,41112403,11000016154091,2023-10-07T00:00:00.000000,competitor
40938301,Mensch Supply,47QTCA20D002A,7000051872,3M,01443290,"","",US,Facepiece Replacement Lens:,Facepiece Replacement Lens: Facepiece Replacement Parts and Adapter,332510C,112.01,46182001,11000084533703,2023-11-13T00:00:00.000000,competitor
40956617,Mensch Supply,47QTCA20D002A,78049,Dynabrade,87504940,"",616026780491,US,"Abrasive Belt: 1/2"" Width, Aluminum Oxid","Abrasive Belt: 1/2"" Width, Aluminum Oxide Non-Woven, Dry & Wet. Minimum order quantity is 10",332510C,6.82,31191507,11000061932377,2023-11-13T00:00:00.000000,competitor
40980684,Mensch Supply,47QTCA20D002A,AC742111AG-01A,PRO-SOURCE,12757928,"","",TW,11 Drawer Top Tool Chest,"11 Drawer Top Tool Chest 41.44"" Wide x 18.63"" Deep x 26.88"" High, 1,100 Lb Capacity, Steel, Red",332510C,753.95,24112401,11000098267844,2023-10-07T00:00:00.000000,competitor
40994516,Mensch Supply,47QTCA20D002A,CHP5161,CHASE PRODUCTS CO.,8641136,"","",US,"CLEANER,A-PUR,FM,18OZ,12","Heavy-Duty All-Purpose Cleaner/degreaser, 18 Oz Aerosol Spray, 12/carton",339940,45.61,47131805,11000053005598,2023-11-13T00:00:00.000000,competitor
40995390,Mensch Supply,47QTCA20D002A,8850717,Kyocera,59161190,"","",CH,XPMT090208 PR1525 Carbide Milling Insert,"XPMT090208 PR1525 Carbide Milling Insert Megacoat Nano Finish, 0.325"" Long x 0.094"" Thick x 1/4"" Wide. Minimal order quantity is 10.",332510C,20.01,23171612,11000066422586,2023-10-07T00:00:00.000000,competitor
40996929,Mensch Supply,47QTCA20D002A,91196584,Hertel,91196576,"","",ES,"Square End Mill: 3/8'' Dia, 3/8'' LOC, 3","Square End Mill: 3/8'' Dia, 3/8'' LOC, 3/8'' Shank Dia, 2-5/32'' OAL, 4 Flutes,Cobalt Single End, TiCN Finish, 30 &deg; Helix, Centercutting, RH Cut, RH Flute",332510C,12.96,27112803,11000084031687,2023-10-07T00:00:00.000000,competitor
41012708,Mensch Supply,47QTCA20D002A,9003290106000,Guhring,69338838,"","",DE,"Screw Machine Length Drill Bit: 0.4173""","Screw Machine Length Drill Bit: 0.4173"" Dia, 130 &deg;, Cobalt Coated, Right Hand Cut, Spiral Flute, Straight-Cylindrical Shank, Series 329",332510C,52.4,23241606,11000028488374,2023-10-07T00:00:00.000000,competitor
41015341,Mensch Supply,47QTCA20D002A,C6NC-1/4-100,MSC,60330164,"","",US,"1/4"" Head Diam, 1/4"" Shank Diam, 6 Flute","1/4"" Head Diam, 1/4"" Shank Diam, 6 Flute 100&deg; Solid Carbide Countersink Bright Finish, 2"" OAL, 0.046"" Nose Diam, Single End, Straight Shank, Right Hand Cut",332510C,19.31,27112803,11000100649374,2023-10-07T00:00:00.000000,competitor
41019015,Mensch Supply,47QTCA20D002A,9031460035700,Guhring,58536723,"","",DE,"Square End Mill: 9/64'' Dia, 1/2'' LOC,","Square End Mill: 9/64'' Dia, 1/2'' LOC, 3/16'' Shank Dia, 2'' OAL, 2 Flutes, Solid Carbide Single End, Uncoated, Spiral Flute, Centercutting, RH Cut, RH Flute,Series 3146",332510C,20.47,27112803,11000097053488,2023-10-07T00:00:00.000000,competitor
41025419,Mensch Supply,47QTCA20D002A,9003450138900,Guhring,69337905,"","",DE,"Taper Shank Drill Bit: 0.5469"" Dia, 1MT,","Taper Shank Drill Bit: 0.5469"" Dia, 1MT, 118 &deg;, Cobalt Oxide Finish, 4.252""Flute Length, 7.4409"" OAL, Cone Relief Point, Spiral Flute",332510C,101.06,23241634,11000096964926,2023-10-07T00:00:00.000000,competitor
41025963,Mensch Supply,47QTCA20D002A,9003450159000,Guhring,69343960,"","",DE,"Taper Shank Drill Bit: 0.626"" Dia, 2MT,","Taper Shank Drill Bit: 0.626"" Dia, 2MT, 118 &deg;, Cobalt Oxide Finish, 4.7244""Flute Length, 8.5827"" OAL, Cone Relief Point, Spiral Flute",332510C,134.41,23241634,11000097049424,2023-10-07T00:00:00.000000,competitor
41033143,Mensch Supply,47QTCA20D002A,9256350120030,Guhring,90274218,"","",DE,"Grooving Insert: GA 30504, Solid Carbide","Grooving Insert: GA 30504, Solid Carbide Firex Finish, Left Hand, 3 mm Cutting Width, 3 mm Max Depth",332510C,39.23,23241605,11000097021394,2023-10-07T00:00:00.000000,competitor
41037922,Mensch Supply,47QTCA20D002A,9069850079420,Guhring,18055152,"","",DE,"Corner Radius End Mill: 7/16"" LOC, 0.02""","Corner Radius End Mill: 7/16"" LOC, 0.02"" Radius, 5 Flutes, Solid Carbide 2"" OAL,5/16"" Shank Dia, 38 &deg; Helix, nano-ACoated, Corner Radius End, Series 6985",332510C,53.37,27112803,11000091669961,2023-10-07T00:00:00.000000,competitor
41054201,Mensch Supply,47QTCA20D002A,ALX40 LAT 613,Schlage,28993228,"","",MX,Lever Locksets; Lockset Type: Cylindrica,Lever Locksets; Lockset Type: Cylindrical Lock ; Key Type: Keyless ; Strike Type: Curved Lip Strike ; Material: Metal ; Finish: Oil Rubbed Bronze,332510C,250.35,46171503,11000098357490,2023-10-07T00:00:00.000000,competitor
41059709,Mensch Supply,47QTCA20D002A,C24188,CLEVELAND,C24188,"",697334241881,US,"1/4"""" Body Diam, 120&deg;, 4"""" OAL, High","1/4"""" Body Diam, 120 , 4"""" OAL, High Speed Steel Spotting Drill 1/4"""" Shank Diam, 25.4mm Flute Length, Right Hand Cut, Series 2645 (MOQ=1, Pkg Qty=1)",332510C,22.16,52101508,11000043913094,2023-10-07T00:00:00.000000,competitor
41062705,Mensch Supply,47QTCA20D002A,9056120033000,Guhring,58524828,"","",DE,"Taper Length Drill Bit: 0.1299"" Dia, 140","Taper Length Drill Bit: 0.1299"" Dia, 140 &deg; FIREX Finish, RH Cut, Spiral Flute, Straight Shank, Series 5612",332510C,224.83,23241634,11000097133079,2023-10-07T00:00:00.000000,competitor
41082096,Mensch Supply,47QTCA20D002A,9257470060090,Guhring,94891678,"","",DE,"Profile Boring Bar: 5.7 mm Min Bore, 37","Profile Boring Bar: 5.7 mm Min Bore, 37 mm Max Depth, Left Hand Cut, Fine GrainSolid Carbide 6 mm Shank Dia, 62 mm OAL, 0.3 mm Corner Radius",332510C,39.91,41113901,11000091668336,2023-10-07T00:00:00.000000,competitor
41086226,Mensch Supply,47QTCA20D002A,EG31CC6L2.5X1.5,VNE,04552345,"","",IL,Sanitary Stainless Steel Pipe Concentric,"Sanitary Stainless Steel Pipe Concentric Reducer: 2-1/2 x 1-1/2"", Clamp Connection Tube OD End Connections, Grade 316/316L",332510C,79.07,27131502,11000023308637,2023-10-07T00:00:00.000000,competitor
41099684,Mensch Supply,47QTCA20D002A,E7WWW-6L1.0,VNE,04652608,"","",IL,"Sanitary Stainless Steel Pipe Tee: 1"", W","Sanitary Stainless Steel Pipe Tee: 1"", Welded Connection Butt Weld x Butt Weld End Connections, Grade 316L",332510C,29.63,40142605,11000028589362,2023-10-07T00:00:00.000000,competitor
41099977,Mensch Supply,47QTCA20D002A,GR25-3/16,Value Collection,04020103,"","",GB,3/16 Inch Diameter Carbide Ball,"3/16 Inch Diameter Carbide Ball 0.0001 Inch Tolerance, Solid Carbide",332510C,3.16,27112803,11000074107970,2023-11-13T00:00:00.000000,competitor
41144510,Mensch Supply,47QTCA20D002A,ECR2025,Energizer.,05000708,"",039800088581,IS,"Size CR2025, Lithium, Button & Coin Cell","Size CR2025, Lithium, Button & Coin Cell Battery 3 Volts, CR2025, ANSI, IEC, NEDA, UL Listed Regulated. Minimal order quantity is 5.",332510C,1.11,26111711,11000044993224,2023-10-07T00:00:00.000000,competitor
41165165,Mensch Supply,47QTCA20D002A,DHX11141,Tekton,10757656,"",020209010341,US,9/64 Inch Hex High-Torque Screwdriver,9/64 Inch Hex High-Torque Screwdriver,332510C,9.78,27111701,11000084723658,2023-10-07T00:00:00.000000,competitor
41169141,Mensch Supply,47QTCA20D002A,CFR23375H,HERTEL,CFR23375H,"",733438161011,US,"3/32"""" RADIUS, 3/8"""" DIAM, 4 FLUTE SOLID","3/32"""" Radius, 3/8"""" Diam, 4 Flute Solid Carbide Corner Rounding End Mill SingleEnd, Uncoated, 2-1/2"""" OAL, 3/8"""" Shank Diam (MOQ=1, Pkg Qty=1)",332510C,42.26,27112803,11000078046713,2023-10-07T00:00:00.000000,competitor
41307477,Mensch Supply,47QTCA20D002A,K7160-16-100,Kuriyama of America,48738637,"","",CA,"1"" ID x 1.29"" OD, 100' Long, PVC Tube","1"" ID x 1.29"" OD, 100' Long, PVC Tube Clear, 70 Max psi",332510C,512.78,40142000,11000022669984,2023-11-13T00:00:00.000000,competitor
41383997,Mensch Supply,47QTCA20D002A,ISCC-087-062,CLIMAX METAL PRODUCTS,ISCC-087-062,"",044861414026,IT,"7/8"""" Inside x 1-5/8"""" Outside Diam, One","7/8"""" Inside x 1-5/8"""" Outside Diam, One Piece Split Clamping Collar 2-1/2"""" Long (MOQ=1, Pkg Qty=1)",332510C,50.85,31162811,11000036695802,2023-10-07T00:00:00.000000,competitor
41421431,Mensch Supply,47QTCA20D002A,LH199,Value Collection,12140620,"","",GB,Label Holders; Backing: Magnetic ; Width,Label Holders; Backing: Magnetic ; Width (Inch): 8 ; Length (Inch): 3 ; Color: Black,332510C,191.7,55121618,11000098297065,2023-10-07T00:00:00.000000,competitor
41436843,Mensch Supply,47QTCA20D002A,REDB152008U,REDIFORM OFFICE PRODUCTS,REDB152008U,"",757286601246,MX,"REFILL,NOTEBOOK,A5","Notebook Refill, Ruled, 8 1/4 X 5 13/16, Cream, 32 Sheets/pack; Refill sheets for Filofax(R) Notebooks. Innovative hole design allows sheets to be repositionedto suit your personal needs. Size: 8 1/4 x 5 13/16; Paper Color(s): Cream; PaperWeight: 1g/m2; Sheets Per Unit: 32.",339940,3.72,14111514,11000048038901,2023-09-11T00:00:00.000000,competitor
41453029,Mensch Supply,47QTCA20D002A,MP419M06F16M2,ELECTRO HARDWARE,MP419M06F16M2,"","",US,"M3x0.50, 10mm OAL, 6mm Across Flats, Alu","M3x0.50, 10mm OAL, 6mm Across Flats, Aluminum Female Hex Circuit Board StandoffFully Threaded, 4mm Body Length, 10mm Thread Depth, Grade T-3, Uncoated (MOQ=10,Pkg Qty=1)",332510C,1.01,31161816,11000016164844,2023-10-07T00:00:00.000000,competitor
41456094,Mensch Supply,47QTCA20D002A,SGA8072,Telemecanique Sensors,49924335,"","",US,"0.8 Inch Detection, Cylinder, Inductive","0.8 Inch Detection, Cylinder, Inductive Proximity Sensor 250 VDC, 250 VDC, 120 VAC, 57mm Long x 25mm Wide",332510C,111.05,41111926,11000043990174,2023-09-11T00:00:00.000000,competitor
41469652,Mensch Supply,47QTCA20D002A,LHGT124-12,Scientific Cutting Tools,44073328,"","",US,Grooving Tool: Retaining Ring,"Grooving Tool: Retaining Ring Solid Carbide, 5/16"" Shank Dia, 0.125"" Groove Width",332510C,80.08,27112809,11000092811392,2023-10-07T00:00:00.000000,competitor
41484251,Mensch Supply,47QTCA20D002A,ZUSAH90108,USA Sealing,08461303,"",193005124557,US,"O-Ring: 0.25"" ID x 0.4375"" OD, 0.206"" Th","O-Ring: 0.25"" ID x 0.4375"" OD, 0.206"" Thick, Dash 108, Nitrile Butadiene RubberRound Cross Section, Shore 90A, Black",332510C,3.85,31181506,11000101181607,2023-10-07T00:00:00.000000,competitor
41591039,Mensch Supply,47QTCA20D002A,TM181K,AccuformNMC,37742426,"","",US,"Worker with Directional Flag, 30"" Wide x","Worker with Directional Flag, 30"" Wide x 30"" High Aluminum Construction RoadwaySign 0.08"" Thick, Black on Orange, Diamond, High Intensity Reflectivity, Post Mount",332510C,136.19,55121710,11000100876154,2023-10-07T00:00:00.000000,competitor
41624014,NETA SCIENTIFIC INC.,GS-07F-5558P,31899,RESTEK CORPORATION,RES-31899,"","",US,SV Stock Mixture Method 525.2...,"Restek SV Stock Mixture Method 525.2 (Revised) 1mL 1000ug/mL Acetone (revised -replaces #31824) (Hazardous, Additional S/H may apply.) - RES",334516,97.32,47101613,11000063554293,2023-09-28T00:00:00.000000,competitor
41626888,"NE WORLDWIDE TECHNOLOGIES , INC",47QSEA20D007X,REDB152008U,REDIFORM OFFICE PRODUCTS,REDB152008U,"","",MX,"REFILL,NOTEBOOK,A5","Notebook Refill, Ruled, 8 1/4 x 5 13/16, Cream, 32 Sheets/Pack",339940,3.4,14111514,11000048038901,2022-01-15T00:00:00.000000,competitor
41673257,Mensch Supply,47QTCA20D002A,ZPEZUHLF128EA,ZEP INC.,8905622,"","",US,"CLEANER,WOOD,LAM,128OZ","Hardwood And Laminate Cleaner, 1 Gal Bottle",339940,10.1,47131801,11000067909062,2023-11-13T00:00:00.000000,competitor
41904999,NEW CENTURY TECHNOLOGIES INC,GS-21F-0088X,ZPEZUHLF128EA,ZEP INC,ZPEZUHLF128EA,"","",US,"CLEANER,WOOD,LAM,128OZ","CLEANER,WOOD,LAM,128OZ",339940,17.2,47131801,11000067909062,2023-10-31T00:00:00.000000,competitor
41910940,NEW CENTURY TECHNOLOGIES INC,GS-21F-0088X,CHP5161,CHASEPROD,CHP5161,"","",US,"CLEANER,A-PUR,FM,18OZ,12","CLEANER,A-PUR,FM,18OZ,12",339940,61.07,47131805,11000053005598,2023-10-31T00:00:00.000000,competitor
42051147,NORTHEAST OFFICE SUPPLY CO LLC,47QSEA19D00CT,NSN2074231,ABILITYONE,NSN2074231,"","",US,"7520012074231 STMP,RCD,RD","7520012074231, PRE-INKED MESSAGE STAMP, RECEIVED, RED",339940OS4,10.52,44121604,11000003953482,2023-10-12T00:00:00.000000,competitor
42066519,"NOREX GROUP, LLC",GS-02F-020CA,LH199,BOX PARTNERS,"","","",US,"3"" x 8"" Magnetic ""C"" Channel Cardholders","Black,3"" x 8"" Magnetic ""C"" Channel Cardholders,Magnetic,25 PER CASE For Sales Support, Quotes, or Customer Service please call 1-888-760-2969 or email sales@norexgroup.com. Volume Discounts Offered. Quote Responses within 2 hours! Over 210,000 Products Same Day Shipping!",3PACK,66.14,44111500,11000019666345,2023-05-31T00:00:00.000000,competitor
42216112,Noble Supply & Logistics,47QSHA19D004Z,32973,WIHA TOOLS,N675X42,"",00084705329734,DE,INSULATED TOOL SET 22 PIECES 1000VAC,"Insulated Tool Set, Number Of Pieces 22, Pliers Included Linesmans Pliers With Crimper 9 In., Long-Nose 8 In., High Leverage Cutter 8 In., Screwdrivers Included Phillips Screwdriver #1, (2) Xeno Slotted/Phillips Screwdriver: #1, #2, (2) Slotted Screwdrivers: 9/64 In., 3/16 In., (2) Phillips Screwdrivers: #1, #2, (2) Square Screwdrivers: #1, #2, Nut Drivers Included 1/4 In., 5/16 In., 11/32 In., 3/8 In., 7/16 In., Tool Storage Included Yes, Tool Storage Type Included Box PLEASE NOTE: For quotes or volume discounts, contact Noble at www.noble.com/rfq / 1.877.999.1911 / govteam@noble.com -- Need help? Let our team find your products for you. Noble offers numerous procurement vehicles to support your mission requirements. Contact us today! www.noble.com/contact-us UPC=00084705329734",332510C,432.47,27113201,11000039087230,2020-07-06T00:00:00.000000,competitor
