jprod_id,contractor_name,contract_number,manufacturer_part_number,manufacturer_name,vendor_part_number,nsn,upc,country_of_origin,product_name,product_description,sin,price,unspc,gsin,date_last_updated,source
7193572,BZ DEFENSE LLC,47QTCA19D0042,39124,SGS,BZ43EZ22,"",00691781391243,US,"3/16"" Diam, 5/8"" LOC, 4 Flute Solid...","BZ DEFENSE SKU# BZ43EZ22 -- MFG. Name: SGS -- MPN: 39124 -- UPC= 691781391243 --UNSPSC= 27112803 -- UOM: EA -- UOM QTY: 1 -- PKG QTY: 1 -- MOQ: 1. 3/16"" Diam,5/8"" LOC, 4 Flute Solid Carbide Ball End Mill. FOR QUOTES, VOLUME DISCOUNTS, STOCK AVAILABILITY OR SPECIAL REQUIREMENTS, PLEASE CONTACT BZ DEFENSE @ +1 (888) 305-5357 OR EMAIL US: GSASales@BZDefense.com. UNSPSC=27112803 UPC=00691781391243",332510C,46.58,23241611,11000013342855,2023-03-06T00:00:00.000000,competitor
7196827,BZ DEFENSE LLC,47QTCA19D0042,0009512500,OSBORN INTERNATIONAL,BZ3M3294,"","",US,"2"" Roller Diam x 1-11/16"" Width, 7/8""...","BZ DEFENSE SKU# BZ3M3294 -- MFG. Name: Osborn International -- MPN: 0009512500 -- UNSPSC= 26111500 -- UOM: EA -- UOM QTY: 1 -- PKG QTY: 1 -- MOQ: 1. 2"" Roller Diam x 1-11/16"" Width, 7/8"" Stud Diam x 2"" Length, Concentric Stud Load Runner. FOR QUOTES, VOLUME DISCOUNTS, STOCK AVAILABILITY OR SPECIAL REQUIREMENTS, PLEASECONTACT BZ DEFENSE @ +1 (888) 305-5357 OR EMAIL US: GSASales@BZDefense.com. UNSPSC=26111500",332510C,93.19,31171505,11000085366087,2023-03-06T00:00:00.000000,competitor
7211066,BZ DEFENSE LLC,47QTCA19D0042,7000051872,3M,BZ3XM569,"","",US,Facepiece Replacement Lens:,"BZ DEFENSE SKU# BZ3XM569 -- MFG. Name: 3M -- MPN: 7000051872 -- UPC= 051138291148 -- UNSPSC= 46182000 -- UOM: EA -- UOM QTY: 1 -- PKG QTY: 1 -- MOQ: 1 Description: Facepiece Replacement Lens: Facepiece Replacement Parts and Adapter. FOR QUOTES, VOLUME DISCOUNTS, STOCK AVAILABILITY OR SPECIAL REQUIREMENTS, PLEASE CONTACT BZ DEFENSE @ +1 (888) 305-5357 OR EMAIL US: GSASales@BZDefense.com.",332510C,124.16,46182001,11000084533703,2023-12-11T00:00:00.000000,competitor
7229688,BZ DEFENSE LLC,47QTCA19D0042,4130030,KENNAMETAL,BZ3GY6U7,"","",US,"Thread Forming Tap: #4-40 UNC, Plug, Va","BZ DEFENSE SKU# BZ3GY6U7 -- MFG. Name: Kennametal -- MPN: 4130030 -- UNSPSC= 23241600 -- UOM: EA -- UOM QTY: 1 -- PKG QTY: 1 -- MOQ: 1 Description: Thread Forming Tap: #4-40 UNC, Plug, Vanadium High Speed Steel, TiN Coated 0.313"" Thread Length, 1.88"" OAL, H3. FOR QUOTES, VOLUME DISCOUNTS, STOCK AVAILABILITY OR SPECIALREQUIREMENTS, PLEASE CONTACT BZ DEFENSE @ +1 (888) 305-5357 OR EMAIL US: GSASales@BZDefense.com.",332510C,35.79,27112806,11000022668297,2023-12-11T00:00:00.000000,competitor
7249032,BZ DEFENSE LLC,47QTCA19D0042,3001603,HAM-LET,BZ23V8U9,"","",IL,Compression Tube Union: Compression x C,"BZ DEFENSE SKU# BZ23V8U9 -- MFG. Name: Ham-Let -- MPN: 3001603 -- UNSPSC= 27121700 -- UOM: EA -- UOM QTY: 1 -- PKG QTY: 1 -- MOQ: 1 Description: Compression Tube Union: Compression x Compression 316 Stainless Steel, ASTM A182, ASTM A213, ASTM A269, ASTM A276, ASTM A479, DIN EN10122-5 & DIN EN10272. FOR QUOTES, VOLUME DISCOUNTS, STOCK AVAILABILITY OR SPECIAL REQUIREMENTS, PLEASE CONTACT BZ DEFENSE@ +1 (888) 305-5357 OR EMAIL US: GSASales@BZDefense.com.",332510C,18.23,27121700,11000016199296,2023-12-11T00:00:00.000000,competitor
7250929,BZ DEFENSE LLC,47QTCA19D0042,66253262704,NORTON,BZ42TG74,"",00662532627041,US,"Surface Grinding Wheel: 12"" Dia, 1""...","BZ DEFENSE SKU# BZ42TG74 -- MFG. Name: Norton -- MPN: 66253262704 -- UPC= 662532627041 -- UNSPSC= 23131503 -- UOM: EA -- UOM QTY: 1 -- PKG QTY: 1 -- MOQ: 1. Surface Grinding Wheel: 12"" Dia, 1"" Thick, 3"" Hole, 46 Grit, J Hardness. FOR QUOTES, VOLUME DISCOUNTS, STOCK AVAILABILITY OR SPECIAL REQUIREMENTS, PLEASE CONTACT BZ DEFENSE @ +1 (888) 305-5357 OR EMAIL US: GSASales@BZDefense.com. UNSPSC=23131503 UPC=00662532627041",332510C,118.26,23131503,11000077569563,2023-03-06T00:00:00.000000,competitor
7252767,BZ DEFENSE LLC,47QTCA19D0042,4702451,IDEAL TRIDON,BZ3FC847,"","",MX,Stainless Steel Auto-Adjustable Worm...,"BZ DEFENSE SKU# BZ3FC847 -- MFG. Name: IDEAL TRIDON -- MPN: 4702451 -- UNSPSC= 31162900 -- UOM: EA -- UOM QTY: 1 -- PKG QTY: 1 -- MOQ: 1. Description: StainlessSteel Auto-Adjustable Worm Drive Clamp 1/2"" Wide x 1/2"" Thick, 1-1/16"" Hose, 1-1/16 to 2"" Diam. FOR QUOTES, VOLUME DISCOUNTS, STOCK AVAILABILITY OR SPECIAL REQUIREMENTS, PLEASE CONTACT BZ DEFENSE @ +1 (888) 305-5357 OR EMAIL US: GSASales@BZDefense.com. UNSPSC=31162900",332510C,8.99,31162900,11000041486521,2023-03-06T00:00:00.000000,competitor
7253692,BZ DEFENSE LLC,47QTCA19D0042,106-8-H,VORTEC,BZ3G6L47,"","",US,"6-1/4"" Long Hose, 400 BTU/Hr Air Capaci","BZ DEFENSE SKU# BZ3G6L47 -- MFG. Name: Vortec -- MPN: 106-8-H -- UNSPSC= 23270000 -- UOM: EA -- UOM QTY: 1 -- PKG QTY: 1 -- MOQ: 1 Description: 6-1/4"" Long Hose, 400 BTU/Hr Air Capacity, 1 Outlet, Cold Air Coolant System 1"" Hose Inside Diam, 6-5/16"" Tank/Unit Length, 1-1/8"" Tank/Unit Width. FOR QUOTES, VOLUME DISCOUNTS, STOCK AVAILABILITY OR SPECIAL REQUIREMENTS, PLEASE CONTACT BZ DEFENSE @ +1 (888) 305-5357 OR EMAIL US: GSASales@BZDefense.com.",332510C,255.57,40101700,11000016021781,2023-12-11T00:00:00.000000,competitor
7262515,BZ DEFENSE LLC,47QTCA19D0042,520MI9W,LEVITON,BZ3HU4V8,"","",SE,Pin & Sleeve Receptacles;...,"BZ DEFENSE SKU# BZ3HU4V8 -- MFG. Name: Leviton -- MPN: 520MI9W -- UNSPSC= 39121400 -- UOM: EA -- UOM QTY: 1 -- PKG QTY: 1 -- MOQ: 1. Description: Pin & Sleeve Receptacles; Receptacle/Part Type: Interlock ; Pin Configuration: 5 ; Number of Poles: 4 ; IEC Pin & Sleeve Style: IEC 60309-1; IEC 60309-2 ; Amperage: 20 ; Voltage: 120/208 VAC . FOR QUOTES, VOLUME DISCOUNTS, STOCK AVAILABILITY OR SPECIAL REQUIREMENTS, PLEASE CONTACT BZ DEFENSE @ +1 (888) 305-5357 OR EMAIL US: GSASales@BZDefense.com. UNSPSC=39121400",332510C,1133.22,39121610,11000002450060,2023-03-06T00:00:00.000000,competitor
7266912,BZ DEFENSE LLC,47QTCA19D0042,CFR23375H,HERTEL,BZ225PW8,"",00733438161011,US,"Corner Rounding End Mill: 3/32"" Radius,","BZ DEFENSE SKU# BZ225PW8 -- MFG. Name: Hertel -- MPN: CFR23375H -- UPC= 733438161011 -- UNSPSC= 27112803 -- UOM: EA -- UOM QTY: 1 -- PKG QTY: 1 -- MOQ: 1 Description: Corner Rounding End Mill: 3/32"" Radius, 3/8"" Diam, 4 Flutes, Solid Carbide 3/8"" Shank Dia, Bright/Uncoated, Single End. FOR QUOTES, VOLUME DISCOUNTS, STOCK AVAILABILITY OR SPECIAL REQUIREMENTS, PLEASE CONTACT BZ DEFENSE @ +1 (888) 305-5357 OR EMAIL US: GSASales@BZDefense.com.",332510C,59.38,27112803,11000078046713,2023-12-11T00:00:00.000000,competitor
7275048,BZ DEFENSE LLC,47QTCA19D0042,31899,HARVEY TOOL,BZ2C9V38,"","",US,"Square End Mill: 0.1'' Dia, 1/2'' LOC,","BZ DEFENSE SKU# BZ2C9V38 -- MFG. Name: Harvey Tool -- MPN: 31899 -- UNSPSC= 27112803 -- UOM: EA -- UOM QTY: 1 -- PKG QTY: 1 -- MOQ: 1 Description: Square End Mill: 0.1'' Dia, 1/2'' LOC, 1/8'' Shank Dia, 2-1/2'' OAL, 3 Flutes, Solid CarbideSingle End, Uncoated, 30 (degrees) Helix, Centercutting, RH Cut, RH Flute. FOR QUOTES, VOLUME DISCOUNTS, STOCK AVAILABILITY OR SPECIAL REQUIREMENTS, PLEASE CONTACT BZ DEFENSE @ +1 (888) 305-5357 OR EMAIL US: GSASales@BZDefense.com.",332510C,37.34,27112803,11000086441564,2023-12-11T00:00:00.000000,competitor
7285871,BZ DEFENSE LLC,47QTCA19D0042,88 01 180,KNIPEX,BZ46MX97,"",00843221000172,DE,"Tongue & Groove Plier: 1-1/8"" Cutting C","BZ DEFENSE SKU# BZ46MX97 -- MFG. Name: Knipex -- MPN: 88 01 180 -- UPC= 843221000172 -- UNSPSC= 27112112 -- UOM: EA -- UOM QTY: 1 -- PKG QTY: 1 -- MOQ: 1 Description: Tongue & Groove Plier: 1-1/8"" Cutting Capacity, Self-Gripping Jaw Alligator Jaw Head, 9 Position, Plastic Handle. FOR QUOTES, VOLUME DISCOUNTS, STOCK AVAILABILITY OR SPECIAL REQUIREMENTS, PLEASE CONTACT BZ DEFENSE @ +1 (888) 305-5357OR EMAIL US: GSASales@BZDefense.com.",332510C,32.63,27111577,11000011779508,2023-12-11T00:00:00.000000,competitor
7302467,BZ DEFENSE LLC,47QTCA19D0042,53029,KEO,BZ44E355,"",00735329530296,US,"Countersink Set: 5 Pc, 1/4 to 1"" Head...","BZ DEFENSE SKU# BZ44E355 -- MFG. Name: Keo -- MPN: 53029 -- UPC= 735329530296 --UNSPSC= 27112800 -- UOM: EA -- UOM QTY: 1 -- PKG QTY: 1 -- MOQ: 1. Description:Countersink Set: 5 Pc, 1/4 to 1"" Head Dia, 1 Flute, 90 (degrees) Included AngleBright (Polished) Finish, High Speed Steel. FOR QUOTES, VOLUME DISCOUNTS, STOCKAVAILABILITY OR SPECIAL REQUIREMENTS, PLEASE CONTACT BZ DEFENSE @ +1 (888) 305-5357 OR EMAIL US: GSASales@BZDefense.com. UNSPSC=27112800 UPC=00735329530296",332510C,113.63,23241606,11000010270775,2023-03-06T00:00:00.000000,competitor
7316297,BZ DEFENSE LLC,47QTCA19D0042,EG31CC6L2.5X1.5,VNE,BZ3V2NU8,"","",IL,Sanitary Stainless Steel Pipe Concentri,"BZ DEFENSE SKU# BZ3V2NU8 -- MFG. Name: VNE -- MPN: EG31CC6L2.5X1.5 -- UNSPSC= 40170000 -- UOM: EA -- UOM QTY: 1 -- PKG QTY: 1 -- MOQ: 1 Description: Sanitary Stainless Steel Pipe Concentric Reducer: 2-1/2 x 1-1/2"", Clamp Connection Tube ODEnd Connections, Grade 316/316L. FOR QUOTES, VOLUME DISCOUNTS, STOCK AVAILABILITY OR SPECIAL REQUIREMENTS, PLEASE CONTACT BZ DEFENSE @ +1 (888) 305-5357 OR EMAIL US: GSASales@BZDefense.com.",332510C,117.17,27131502,11000023308637,2023-12-11T00:00:00.000000,competitor
7320999,BZ DEFENSE LLC,47QTCA19D0042,74130998,HERTEL,BZ3F6WG6,"","",US,"Screw Machine Length Drill Bit: #47, 13","BZ DEFENSE SKU# BZ3F6WG6 -- MFG. Name: Hertel -- MPN: 74130998 -- UNSPSC= 23241635 -- UOM: EA -- UOM QTY: 1 -- PKG QTY: 1 -- MOQ: 12 Description: Screw MachineLength Drill Bit: #47, 135 (degrees) Point, Cobalt Bright/Uncoated Coated, 1-3/4"" OAL, Right Hand Cut, Straight-Cylindrical Shank. FOR QUOTES, VOLUME DISCOUNTS,STOCK AVAILABILITY OR SPECIAL REQUIREMENTS, PLEASE CONTACT BZ DEFENSE @ +1 (888) 305-5357 OR EMAIL US: GSASales@BZDefense.com.",332510C,2.38,23241605,11000078048863,2023-12-11T00:00:00.000000,competitor
7333877,BZ DEFENSE LLC,47QTCA19D0042,818,DIXON VALVE & COUPLING,BZ353YF7,"","",US,"7-11/16 to 8-3/16"" OD, Double Bolt...","BZ DEFENSE SKU# BZ353YF7 -- MFG. Name: Dixon Valve & Coupling -- MPN: 818 -- UNSPSC= 31162900 -- UOM: EA -- UOM QTY: 1 -- PKG QTY: 1 -- MOQ: 1. Description: 7-11/16 to 8-3/16"" OD, Double Bolt Iron Clamp Plated Malleable Iron. FOR QUOTES, VOLUME DISCOUNTS, STOCK AVAILABILITY OR SPECIAL REQUIREMENTS, PLEASE CONTACT BZ DEFENSE @ +1 (888) 305-5357 OR EMAIL US: GSASales@BZDefense.com. UNSPSC=31162900",332510C,66.63,31162906,11000013325482,2023-03-06T00:00:00.000000,competitor
7337857,BZ DEFENSE LLC,47QTCA19D0042,70794,ALBRECHT,BZ232XP9,"","",DE,Drill Chuck Jaw Guide: C160 & CP160 Com,"BZ DEFENSE SKU# BZ232XP9 -- MFG. Name: Albrecht -- MPN: 70794 -- UNSPSC= 27112807 -- UOM: EA -- UOM QTY: 1 -- PKG QTY: 1 -- MOQ: 1 Description: Drill Chuck JawGuide: C160 & CP160 Compatible, Use with Classic Keyless Drill Chuck & Classic-Plus Drill Chuck Compatible with Chuck No. C160; CP160, For Use with Classic Keyless, Classic-Plus Drill Chucks. FOR QUOTES, VOLUME DISCOUNTS, STOCK AVAILABILITYOR SPECIAL REQUIREMENTS, PLEASE CONTACT BZ DEFENSE @ +1 (888) 305-5357 OR EMAILUS: GSASales@BZDefense.com.",332510C,119.95,27112807,11000074665132,2023-12-11T00:00:00.000000,competitor
7348481,BZ DEFENSE LLC,47QTCA19D0042,C24188,CLEVELAND,BZ43L2X8,"",00697334241881,US,"120(degrees) 4"" OAL High Speed Steel...","BZ DEFENSE SKU# BZ43L2X8 -- MFG. Name: Cleveland -- MPN: C24188 -- UPC= 697334241881 -- UNSPSC= 23241600 -- UOM: EA -- UOM QTY: 1 -- PKG QTY: 1 -- MOQ: 1 Description: 120(degrees) 4"" OAL High Speed Steel Spotting Drill Bright/Uncoated, 1"" Flute Length, 1/4"" Shank Diam, RH Cut, Series 2645. FOR QUOTES, VOLUME DISCOUNTS,STOCK AVAILABILITY OR SPECIAL REQUIREMENTS, PLEASE CONTACT BZ DEFENSE @ +1 (888) 305-5357 OR EMAIL US: GSASales@BZDefense.com.",332510C,28.12,52101508,11000043913094,2023-12-11T00:00:00.000000,competitor
7350256,BZ DEFENSE LLC,47QTCA19D0042,C6NC-1/4-100,MSC,BZ26P4M6,"","",US,"1/4"" Head Diam, 1/4"" Shank Diam, 6 Flut","BZ DEFENSE SKU# BZ26P4M6 -- MFG. Name: MSC -- MPN: C6NC-1/4-100 -- UNSPSC= 27112812 -- UOM: EA -- UOM QTY: 1 -- PKG QTY: 1 -- MOQ: 1 Description: 1/4"" Head Diam, 1/4"" Shank Diam, 6 Flute 100(degrees) Solid Carbide Countersink Bright Finish,2"" OAL, 0.046"" Nose Diam, Single End, Straight Shank, Right Hand Cut. FOR QUOTES, VOLUME DISCOUNTS, STOCK AVAILABILITY OR SPECIAL REQUIREMENTS, PLEASE CONTACTBZ DEFENSE @ +1 (888) 305-5357 OR EMAIL US: GSASales@BZDefense.com.",332510C,28.67,27112803,11000100649374,2023-12-11T00:00:00.000000,competitor
7350498,BZ DEFENSE LLC,47QTCA19D0042,AC742111AG-01A,PRO-SOURCE,BZ25V4P5,"","",TW,"Tool Chest: 11 Drawers, 18-5/8"" OAD, 26","BZ DEFENSE SKU# BZ25V4P5 -- MFG. Name: PRO-SOURCE -- MPN: AC742111AG-01A -- UNSPSC= 24112401 -- UOM: EA -- UOM QTY: 1 -- PKG QTY: 1 -- MOQ: 1 Description: ToolChest: 11 Drawers, 18-5/8"" OAD, 26-7/8"" OAH, 41-7/16"" OAW 1,100 lb Capacity, Steel, Red. FOR QUOTES, VOLUME DISCOUNTS, STOCK AVAILABILITY OR SPECIAL REQUIREMENTS, PLEASE CONTACT BZ DEFENSE @ +1 (888) 305-5357 OR EMAIL US: GSASales@BZDefense.com.",332510C,980.34,24112401,11000098267844,2023-12-11T00:00:00.000000,competitor
7358774,BZ DEFENSE LLC,47QTCA19D0042,9012430075400,GUHRING,BZ3E7VG8,"","",DE,"Jobber Length Drill Bit: 0.2969"" Dia, 1","BZ DEFENSE SKU# BZ3E7VG8 -- MFG. Name: Guhring -- MPN: 9012430075400 -- UNSPSC=23241634 -- UOM: EA -- UOM QTY: 1 -- PKG QTY: 1 -- MOQ: 1 Description: Jobber Length Drill Bit: 0.2969"" Dia, 140 (degrees), Solid Carbide TiN Finish, RH Cut, Spiral Flute, Straight-Cylindrical Shank. FOR QUOTES, VOLUME DISCOUNTS, STOCK AVAILABILITY OR SPECIAL REQUIREMENTS, PLEASE CONTACT BZ DEFENSE @ +1 (888) 305-5357OR EMAIL US: GSASales@BZDefense.com.",332510C,124.4,23241605,11000016210219,2023-12-11T00:00:00.000000,competitor
7360516,BZ DEFENSE LLC,47QTCA19D0042,9690234,WIKA,BZ25W5G7,"","",US,"Pressure Gauge: 1-1/2"" Dial, 1/8"" Threa","BZ DEFENSE SKU# BZ25W5G7 -- MFG. Name: Wika -- MPN: 9690234 -- UNSPSC= 41112412-- UOM: EA -- UOM QTY: 1 -- PKG QTY: 1 -- MOQ: 1 Description: Pressure Gauge: 1-1/2"" Dial, 1/8"" Thread, NPT, Center Back Mount Acrylonitrile Butadiene Styrene Case, Brass Wetted Parts, 3-2-3% of Scale Accuracy. FOR QUOTES, VOLUME DISCOUNTS,STOCK AVAILABILITY OR SPECIAL REQUIREMENTS, PLEASE CONTACT BZ DEFENSE @ +1 (888) 305-5357 OR EMAIL US: GSASales@BZDefense.com.",332510C,22.09,41112403,11000016154091,2023-12-11T00:00:00.000000,competitor
7369915,BZ DEFENSE LLC,47QTCA19D0042,89604,PFERD,BZ25R749,"",00697940896048,US,"3/4"" Wide Horsehair Acid Brush","BZ DEFENSE SKU# BZ25R749 -- MFG. Name: PFERD -- MPN: 89604 -- UPC= 697940896048-- UNSPSC= 23271700 -- UOM: EA -- UOM QTY: 1 -- PKG QTY: 1 -- MOQ: 1 Description: 3/4"" Wide Horsehair Acid Brush 6"" Overall Length, Tin Handle. FOR QUOTES, VOLUME DISCOUNTS, STOCK AVAILABILITY OR SPECIAL REQUIREMENTS, PLEASE CONTACT BZ DEFENSE @ +1 (888) 305-5357 OR EMAIL US: GSASales@BZDefense.com.",332510C,1.16,27113002,11000013291230,2023-12-11T00:00:00.000000,competitor
7384985,BZ DEFENSE LLC,47QTCA19D0042,91196584,HERTEL,BZ3F5U48,"","",ES,"Square End Mill: 3/8'' Dia, 3/8''...","BZ DEFENSE SKU# BZ3F5U48 -- MFG. Name: Hertel -- MPN: 91196584 -- UNSPSC= 27112803 -- UOM: EA -- UOM QTY: 1 -- PKG QTY: 1 -- MOQ: 1. Description: Square End Mill: 3/8'' Dia, 3/8'' LOC, 3/8'' Shank Dia, 2-5/32'' OAL, 4 Flutes, Cobalt SingleEnd, TiCN Finish, 30 (degrees) Helix, Centercutting, RH Cut, RH Flute. FOR QUOTES, VOLUME DISCOUNTS, STOCK AVAILABILITY OR SPECIAL REQUIREMENTS, PLEASE CONTACTBZ DEFENSE @ +1 (888) 305-5357 OR EMAIL US: GSASales@BZDefense.com. UNSPSC=27112803",332510C,28.92,27112803,11000084031687,2023-03-06T00:00:00.000000,competitor
7404383,BZ DEFENSE LLC,47QTCA19D0042,TM181K,ACCUFORMNMC,BZ3LC257,"","",US,"Worker with Directional Flag, 30"" Wide","BZ DEFENSE SKU# BZ3LC257 -- MFG. Name: AccuformNMC -- MPN: TM181K -- UNSPSC= 55121710 -- UOM: EA -- UOM QTY: 1 -- PKG QTY: 1 -- MOQ: 1 Description: Worker withDirectional Flag, 30"" Wide x 30"" High Aluminum Construction Roadway Sign 0.08"" Thick, Black on Orange, Diamond, High Intensity Reflectivity, Post Mount. FOR QUOTES, VOLUME DISCOUNTS, STOCK AVAILABILITY OR SPECIAL REQUIREMENTS, PLEASE CONTACT BZ DEFENSE @ +1 (888) 305-5357 OR EMAIL US: GSASales@BZDefense.com.",332510C,158.0,55121710,11000100876154,2023-12-11T00:00:00.000000,competitor
7406949,BZ DEFENSE LLC,47QTCA19D0042,71146,COLLIS TOOL,BZ42X2H8,"",00662669711460,US,"#32, MT1 Outside Morse Taper, Drill Dri","BZ DEFENSE SKU# BZ42X2H8 -- MFG. Name: Collis Tool -- MPN: 71146 -- UPC= 662669711460 -- UNSPSC= 27112800 -- UOM: EA -- UOM QTY: 1 -- PKG QTY: 1 -- MOQ: 1 Description: #32, MT1 Outside Morse Taper, Drill Driver 3/16 Inch Projection. FOR QUOTES, VOLUME DISCOUNTS, STOCK AVAILABILITY OR SPECIAL REQUIREMENTS, PLEASE CONTACT BZ DEFENSE @ +1 (888) 305-5357 OR EMAIL US: GSASales@BZDefense.com.",332510C,37.24,23241606,11000018355938,2023-12-11T00:00:00.000000,competitor
7414717,BZ DEFENSE LLC,47QTCA19D0042,83863,KEO,BZ25K874,"","",US,"Side Milling Cutter: 5"" Cutter Dia, 11/","BZ DEFENSE SKU# BZ25K874 -- MFG. Name: Keo -- MPN: 83863 -- UNSPSC= 23241623 --UOM: EA -- UOM QTY: 1 -- PKG QTY: 1 -- MOQ: 1 Description: Side Milling Cutter:5"" Cutter Dia, 11/32"" Cutting Width, 1"" Arbor Hole, 24 Teeth TiCN Finish, Staggered Tooth. FOR QUOTES, VOLUME DISCOUNTS, STOCK AVAILABILITY OR SPECIAL REQUIREMENTS, PLEASE CONTACT BZ DEFENSE @ +1 (888) 305-5357 OR EMAIL US: GSASales@BZDefense.com.",332510C,400.28,23151901,11000057201613,2023-12-11T00:00:00.000000,competitor
7417009,BZ DEFENSE LLC,47QTCA19D0042,PS-MH-HPC1-016,VALUE COLLECTION,BZ3ZX4P3,"",00470775502748,TW,"Manual Hydraulic Pump: 1 Stage, 1.594""","BZ DEFENSE SKU# BZ3ZX4P3 -- MFG. Name: Value Collection -- MPN: PS-MH-HPC1-016 -- UPC= 470775502748 -- UNSPSC= 40151533 -- UOM: EA -- UOM QTY: 1 -- PKG QTY: 1 -- MOQ: 1 Description: Manual Hydraulic Pump: 1 Stage, 1.594"" Piston Dia, Steel Pump 3/8"" NPTF Port. FOR QUOTES, VOLUME DISCOUNTS, STOCK AVAILABILITY OR SPECIALREQUIREMENTS, PLEASE CONTACT BZ DEFENSE @ +1 (888) 305-5357 OR EMAIL US: GSASales@BZDefense.com.",332510C,379.28,27121602,11000082228334,2023-12-11T00:00:00.000000,competitor
7445951,BZ DEFENSE LLC,47QTCA19D0042,MP419M06F16M2,ELECTRO HARDWARE,BZ28GY85,"","",US,Female Hex Circuit Board Standoff: M3 x,"BZ DEFENSE SKU# BZ28GY85 -- MFG. Name: Electro Hardware -- MPN: MP419M06F16M2 --UNSPSC= 31161816 -- UOM: EA -- UOM QTY: 1 -- PKG QTY: 1 -- MOQ: 10 Description:Female Hex Circuit Board Standoff: M3 x 0.5, 10 mm OAL, 6 mm Width Across FlatsFully Threaded, 10 mm Thread Depth, Aluminum, Plain Finish, QQ-A-225A Comp 2. FOR QUOTES, VOLUME DISCOUNTS, STOCK AVAILABILITY OR SPECIAL REQUIREMENTS, PLEASECONTACT BZ DEFENSE @ +1 (888) 305-5357 OR EMAIL US: GSASales@BZDefense.com.",332510C,1.13,31161816,11000016164844,2023-12-11T00:00:00.000000,competitor
7449089,CADDO DESIGN INC,47QSEA21D004Y,REDB152008U,REDIFORM OFFICE PRODUCTS,REDB152008U,"",00757286601246,MX,"REFILL,NOTEBOOK,A5","NOTEBOOK REFILLS, 8-HOLE, 8.25 X 5.81, NARROW RULE, 32/PACK",339940OS4,4.09,14111514,11000048038901,2023-08-15T00:00:00.000000,competitor
7453339,BZ DEFENSE LLC,47QTCA19D0042,GR25-3/16,VALUE COLLECTION,BZ35F5N3,"","",GB,3/16 Inch Diameter Carbide Ball,"BZ DEFENSE SKU# BZ35F5N3 -- MFG. Name: Value Collection -- MPN: GR25-3/16 -- UNSPSC= 30100000 -- UOM: EA -- UOM QTY: 1 -- PKG QTY: 1 -- MOQ: 1. 3/16 Inch Diameter Carbide Ball. FOR QUOTES, VOLUME DISCOUNTS, STOCK AVAILABILITY OR SPECIAL REQUIREMENTS, PLEASE CONTACT BZ DEFENSE @ +1 (888) 305-5357 OR EMAIL US: GSASales@BZDefense.com. UNSPSC=30100000",332510C,8.05,27112803,11000074107970,2023-03-06T00:00:00.000000,competitor
7463157,BZ DEFENSE LLC,47QTCA19D0042,E7WWW-6L1.0,VNE,BZ3V2MJ4,"","",IL,"Sanitary Stainless Steel Pipe Tee: 1"",","BZ DEFENSE SKU# BZ3V2MJ4 -- MFG. Name: VNE -- MPN: E7WWW-6L1.0 -- UNSPSC= 40170000 -- UOM: EA -- UOM QTY: 1 -- PKG QTY: 1 -- MOQ: 1 Description: Sanitary Stainless Steel Pipe Tee: 1"", Welded Connection Butt Weld x Butt Weld End Connections,Grade 316L. FOR QUOTES, VOLUME DISCOUNTS, STOCK AVAILABILITY OR SPECIAL REQUIREMENTS, PLEASE CONTACT BZ DEFENSE @ +1 (888) 305-5357 OR EMAIL US: GSASales@BZDefense.com.",332510C,44.29,40142605,11000028589362,2023-12-11T00:00:00.000000,competitor
7477913,BZ DEFENSE LLC,47QTCA19D0042,ISCC-087-062,CLIMAX METAL PRODUCTS,BZ3X8GM6,"",00044861414026,US,"7/8"" Inside x 1-5/8"" Outside Diam, One","BZ DEFENSE SKU# BZ3X8GM6 -- MFG. Name: Climax Metal Products -- MPN: ISCC-087-062 -- UPC= 044861414026 -- UNSPSC= 31160000 -- UOM: EA -- UOM QTY: 1 -- PKG QTY:1 -- MOQ: 1 Description: 7/8"" Inside x 1-5/8"" Outside Diam, One Piece Split Clamping Collar 2-1/2"" Long. FOR QUOTES, VOLUME DISCOUNTS, STOCK AVAILABILITY OR SPECIAL REQUIREMENTS, PLEASE CONTACT BZ DEFENSE @ +1 (888) 305-5357 OR EMAIL US: GSASales@BZDefense.com.",332510C,61.11,31162811,11000036695802,2023-12-11T00:00:00.000000,competitor
7512476,"CAPP, INC.",GS-21F-0116X,18226,BLODGETT,BLGT-18226,"","",US,"TIMER, 60 MIN 240V 60HZ","TIMER, 60 MIN 240V 60HZ. FITS BLODGETT 18226",332510C,153.24,39121523,11000039400030,2023-11-28T00:00:00.000000,competitor
7679937,"CAPRICE ELECTRONICS, INC.",GS-21F-0083Y,05003531001,WERA,CEI04019415,"",04013288121059,CZ,8796 LA ZYKLOP FLEX.-LOCK EXTENSION....,"8796 LA ZYKLOP FLEX.-LOCK EXTENSION. LONG. 1/4"" FLEXIBLE-LOCKING EXTENSION, LONG1/4"" EAN=04013288121059",332510C,9.39,27112809,11000049850303,2023-11-03T00:00:00.000000,competitor
7851308,"CAPRICE ELECTRONICS, INC.",GS-21F-0083Y,106-8-H,VORTEC,CEI05804805,"","",US,"6-1/4"" Long Hose, 400 BTU/Hr Air...","6-1/4"" Long Hose, 400 BTU/Hr Air Capacity, 1 Outlet, Cold Air Coolant System 1""Hose Inside Diam, 6-5/16"" Tank/Unit Length, 1-1/8"" Tank/Unit Width (MOQ=1, Pkg Qty=1)",332510C,208.06,40101700,11000016021781,2023-11-03T00:00:00.000000,competitor
7911558,"CAPRICE ELECTRONICS, INC.",GS-21F-0083Y,18226,BOSTON LEATHER,CEI07850715,"","",US,Aged Bark Chieftain / Snap / Silver...,Aged Bark Chieftain / Snap / Silver Roller,332510C,26.53,53141506,11000097579821,2023-11-03T00:00:00.000000,competitor
7942072,"CAPRICE ELECTRONICS, INC.",GS-21F-0083Y,31899,NVENT HOFFMAN,CEI04966336,"","",US,"Solid Base,fits 600x800mm,SS Type 304","G6838826, Solid Base,fits 600x800mm,SS Type 304",332510C,1943.59,39131704,11000084902369,2023-11-03T00:00:00.000000,competitor
7966571,"CAPRICE ELECTRONICS, INC.",GS-21F-0083Y,18414,ORS NASCO,CEI02437219,"","",US,CRC Bright Zinc-It Instant Cold...,CRC Bright Zinc-It Instant Cold Galvanize - 16 oz Aerosol Can - 18414 UPC=00078254184142,332510C,19.15,15121802,11000068634693,2023-11-03T00:00:00.000000,competitor
8022553,"CAPRICE ELECTRONICS, INC.",GS-21F-0083Y,19110,YELLOW JACKET,CEI07642354,"","",US,Gauge Quick Coupler,Deep knurling for easy handling; Warning; Cancer and Reproductive Harm - www.P65warnings.ca.gov,332510C,14.65,46181508,11000072120478,2023-11-03T00:00:00.000000,competitor
8048116,"CAPRICE ELECTRONICS, INC.",GS-21F-0083Y,30C-8,HOLLAENDER,CEI04811862,"","",US,"Structural Pipe Fitting, Swivel","G5779193, Structural Pipe Fitting, Brand and Series Hollaender Speed-Rail(R), Finish Mill, Fitting Type Adjustable Swivel, Inside Dia. 1.925 in, Material Aluminum, Modular Component Connection Fitting, Nominal Pipe Size 1.5 in, Rated for Fall Prevention Yes, Series Speed-Rail(R), Guardrail Material Internal/External Reverse Knurled, Standards ASTM B179 535, Tensile Strength 32510 lb, Weight 1.18 lb",332510C,31.04,21101510,11000010053980,2023-11-03T00:00:00.000000,competitor
8086834,"CAPRICE ELECTRONICS, INC.",GS-21F-0083Y,39124,BRADY,CEI00850335,"",00754473391249,US,SPANISH SIGN,SPANISH SIGN UPC=00754473391249,332510C,9.96,55121704,11000061871452,2023-11-03T00:00:00.000000,competitor
8103444,"CAPRICE ELECTRONICS, INC.",GS-21F-0083Y,4500569,ISCAR,CEI05621233,"","",IL,"ER32 Taper Shank, 3/8"" Hole Diam,...","ER32 Taper Shank, 3/8"" Hole Diam, Shrink-Fit Tool Holder/Adapter 2-1/2"" Projection, 0.9"" Nose Diam, 1.42"" Clamping Depth, Through Coolant (MOQ=1, Pkg Qty=1)",332510C,109.47,31181600,11000063042474,2023-11-03T00:00:00.000000,competitor
8207268,"CAPRICE ELECTRONICS, INC.",GS-21F-0083Y,48508,GREENFIELD INDUSTRIES,CEI02576307,"","",US,157 1/8,157 1/8; Must be ordered in multiples of 12,332510C,22.45,27112806,11000032762655,2023-11-03T00:00:00.000000,competitor
8224632,"CAPRICE ELECTRONICS, INC.",GS-21F-0083Y,4702451,IDEAL TRIDON,CEI05621065,"","",MX,Stainless Steel Auto-Adjustable Worm...,"Stainless Steel Auto-Adjustable Worm Drive Clamp 1/2"" Wide x 1/2"" Thick, 1-1/16""Hose, 1-1/16 to 2"" Diam (MOQ=1, Pkg Qty=1)",332510C,3.45,31162900,11000041486521,2023-11-03T00:00:00.000000,competitor
8233402,"CAPRICE ELECTRONICS, INC.",GS-21F-0083Y,497.58x4x75BYL,WEARWELL,CEI00518399,"",00715411015306,US,Smart Diamond Plate Color,Smart Diamond Plate Color Black w/Yellow Size 4' x 75' UPC=00715411015306,332510C,1809.44,52101510,11000030205683,2023-11-03T00:00:00.000000,competitor
8246337,"CAPRICE ELECTRONICS, INC.",GS-21F-0083Y,53029,DYNABRADE,CEI04999917,"","",US,Drill Chuck,"G3668003, Drill Chuck",332510C,70.31,27112808,11000046074666,2023-11-03T00:00:00.000000,competitor
8299698,"CAPRICE ELECTRONICS, INC.",GS-21F-0083Y,47131,JERGENS,CEI05786381,"","",US,"3/4"" Stud, Low Carbon Steel, Plain...","3/4"" Stud, Low Carbon Steel, Plain Strap Clamp 1-1/2"" Travel, 6"" OAL x 1-1/2"" Wide x 1"" High, Black Oxide Finish, Tapered Nose (MOQ=1, Pkg Qty=1)",332510C,48.02,31162300,11000019487889,2023-11-03T00:00:00.000000,competitor
8387531,"CAPRICE ELECTRONICS, INC.",GS-21F-0083Y,69957399629,MERIT ABRASIVES,CEI05371422,"",00699573996294,US,"1-1/2"" 60 Grit Aluminum Oxide Quick...","1-1/2"" 60 Grit Aluminum Oxide Quick Change Disc Type S Attachment, Brown, Coated, Cloth Backing, 30,000 RPM, Power-Lock Type 2 Compatible (MOQ=100, Pkg Qty=1) UPC=00699573996294",332510C,0.36,31191506,11000041513988,2023-11-03T00:00:00.000000,competitor
